标题,发表时间,来源
外交部：中国将以公平合理的价格向世界提供新冠肺炎疫苗,2020/10/1 7:24,国内・国际#江苏频道
1月17日0时至12时辽宁无新增新冠肺炎确诊病例,2021/1/17 15:31,头条二
美今年“超额死亡”近30万人 2/3直接归因于新冠肺炎,2020/10/29 9:30,美国频道
江苏举行抗击新冠肺炎疫情先进事迹首场报告会,2020/11/28 7:27,政治#江苏频道
世卫组织：全球新冠肺炎确诊超6914万例 死亡超157万,2020/12/12 9:12,国际#独家稿库#滚动新闻
美国将在大选前分发新冠疫苗？多国球场接连“沦陷”,2020/9/3 18:20,美国频道
运城市新冠肺炎疫情防控指挥部通告 〔2021〕第6号,2021/1/13 14:51,最新消息
黑龙江省农业农村厅发布《农村地区新冠肺炎疫情防控倡议书》,2021/1/15 17:50,防控疫情，各地在行动#李宏E#【权威发布】黑龙江省全力做好新型冠状病毒肺炎疫情防控工作#2020专题#人民网专稿#黑龙江频道#新闻聚焦#抗疫情
两名刚到日本美国军人被发现感染新冠 美军的回应很“淡定”,2020/10/16 11:27,吴锋#贵州频道#采编人员信息统计#军事扫描#频道稿件编辑统计查询
亚欧多国单日新增新冠病例创新高 俄计划新年前大规模接种疫苗,2020/11/28 8:20,人民健康网
世卫组织非洲办事处指出：非洲慢性病人患新冠肺炎风险更高,2020/9/29 14:11,教育| 科技#上海频道
逾170万人参加香港新冠病毒普及社区检测计划,2020/9/14 8:40,港澳
10月13日辽宁无新增新冠肺炎确诊病例,2020/10/14 7:55,头条二
印尼新冠肺炎新增确诊病例3143例，累计突破41万例,2020/11/1 8:30,滚动新闻#亚太#徐伟#国际
关于抗击新冠肺炎疫情国家级表彰拟表彰对象的公示,2020/8/28 18:46,吉林频道#要闻#时政#社会
12月23日河南省新增新冠肺炎确诊病例1例,2020/12/24 8:36,河南频道
【#兰州一冷链食品标本新冠检测阳性#】据...,2020/11/13 18:57,
关于抗击新冠肺炎疫情国家级表彰拟表彰对象的公示,2020/8/28 15:56,湖北频道#新闻中心#国内#环球#张颖
《三级医院评审标准》时隔九年再次修订 增加新冠疫情常态化防控要求,2020/12/30 7:33,政策声音#人民健康网
世卫组织：全球累计新冠确诊病例达40251950例,2020/10/21 9:01,国际要闻
昨天上海无新增本地新冠肺炎确诊病例，新增5例境外输入病例,2021/3/19 11:25,上海频道#社会| 法治#滚动新闻
全国抗击新冠肺炎疫情表彰大会在京隆重举行,2020/9/8 19:00,图片频道#国内图片
西班牙113岁老妪战胜新冠,2020/5/15 23:29,江西频道#国内国际
意大利现有新冠患者降至15255人,2020/7/2 17:08,滚动新闻#欧洲#国际
麦考尔报告政治化新冠疫情的谎言与事实真相,2020/8/28 20:22,国际
美国众多人士强调新冠病毒源自自然界,2020/5/7 13:13,国际
世卫组织：全球累计新冠确诊病例达32110656例,2020/9/26 8:20,江西频道#社会#国内国际
俄罗斯首款新冠疫苗已获国家注册,2020/8/12 17:03,要闻#吉林频道
美国犹他州工作场所非白人族裔新冠感染率更高,2020/8/19 18:58,美国频道
习近平：在全国抗击新冠肺炎疫情表彰大会上的讲话,2020/10/15 15:37,高层动态
俄罗斯首款新冠疫苗已获国家注册,2020/8/12 16:41,四川频道#时政
英国约40所大学报告新冠疫情 数千名学生隔离,2020/9/29 11:13,频道稿件编辑统计查询#国际要闻#陈晶晶#采编人员信息统计#贵州频道
世卫组织：全球累计新冠确诊病例达40251950例,2020/10/21 8:06,国际#滚动新闻#全球抗疫进行时
意甲都灵一球员感染新冠病毒,2020/5/7 20:18,滚动新闻#体育#陕西频道
济南市确定15家医院为秋冬季新冠肺炎疫情医疗救治定点医院,2020/10/13 9:20,济南#滚动新闻#山东频道
新冠疫苗上市后如何监管疫苗质量？国家药监局：四项措施力保疫苗质量安全,2020/10/20 17:54,人民健康网#原创稿件#国务院联防联控机制介绍新冠疫苗有关情况#政策声音#行业热点
南京通报新增1例境外输入新冠肺炎确诊病例详情,2021/1/8 23:05,江苏频道#南京要闻#社会
比利时和卢森堡弃用羟氯喹治疗新冠肺炎,2020/5/28 21:41,国际#滚动新闻#欧洲
习近平在全国抗击新冠肺炎疫情表彰大会上发表重要讲话,2020/9/8 20:16,习近平#国内活动#时政新闻#中央领导人报道集
全球合作加强新冠诊疗和疫苗研发,2020/4/26 15:51,人民健康网
日本单日新增新冠病例400多例　自卫队多人确诊,2020/10/5 10:48,上海频道#滚动新闻#社会| 法治
美国将在大选前分发新冠疫苗？多国球场接连“沦陷”,2020/9/4 0:40,国际要闻
意大利现有新冠患者降至18303人,2020/6/26 22:42,滚动新闻#全球抗疫进行时#欧洲#国际
国家卫健委：预防新冠肺炎最好的办法就是接种疫苗,2021/3/15 15:53,热点短视频
国家药监局：以最快速度保障安全、有效的新冠疫苗上市,2021/3/15 15:53,热点短视频
海南省发布“十一”假期新冠肺炎疫情防控措施,2020/9/20 16:44,编辑稿件统计#经济民生#海南新闻#卢少雄#海南要闻#人民网海南频道
世卫组织：全球累计新冠确诊病例达41104946例,2020/10/23 9:03,人民健康网
江苏发布新版港口口岸新冠肺炎疫情防控指南,2020/11/25 10:47,江苏频道#江苏海事#头条#本网专稿#滚动#海事之声#海事要闻#民生#专稿#记者专稿
西班牙：废水监测发现新冠病毒早期踪迹,2020/6/30 15:41,人民健康网
湖北省卫健委：23日新增新冠肺炎确诊病例0例,2020/9/24 10:34,新闻中心#热点专题#聚焦新型冠状病毒性肺炎#湖北频道#本网原创#实况武汉#最新播报#关喜艳
习近平：在全国抗击新冠肺炎疫情表彰大会上的讲话,2020/10/16 8:08,“不忘初心、牢记使命”主题教育官方网站#高层动态
世卫组织：全球累计新冠确诊病例达41104946例,2020/10/23 7:51,江西频道#国内国际
北京新冠肺炎疫情防控工作领导小组调度疫情处置工作,2021/1/26 8:11,北京频道#应对新型冠状病毒肺炎疫情 北京在行动#市委市政府指示#滚动新闻#时政要闻
湖北推出新冠肺炎康复门诊,2020/4/22 15:07,陕西频道#要闻#社会#滚动新闻
美国累计新冠确诊病例超过400万例,2020/7/24 16:44,国际
日本累计新冠确诊超11万 政府专家小组献“紧急提议”,2020/11/11 8:07,国际
美国众多人士强调新冠病毒源自自然界,2020/5/7 16:32,人民日报#健康舆情#人民健康网#人民健康融媒体联盟
专家答疑：公众何时可以接种新冠肺炎疫苗？哪些人不适合接种？如何进行第二剂接种？,2021/1/22 10:19,西藏频道#滚动新闻#高原健康
世卫组织：全球累计新冠确诊病例达30949804例,2020/9/22 16:56,国际
香港新增两例新冠肺炎确诊病例,2020/6/25 6:35,港澳#港澳新闻滚动#社会万象
世卫组织欧洲办事处呼吁协调合作应对新冠疫情反弹,2020/9/18 17:32,国际要闻
关于抗击新冠肺炎疫情国家级表彰拟表彰对象的公示,2020/8/28 18:36,天津频道#国内要闻
北京新冠肺炎疫情在院病例全部清零,2020/8/27 17:15,人民健康网
山西省抗击新冠肺炎疫情先进个人先进集体等推荐对象公示,2020/9/27 6:47,山西要闻
王东峰主持召开河北省应对新冠肺炎疫情工作领导小组会议,2021/1/11 8:59,领导活动
习近平在全国抗击新冠肺炎疫情表彰大会上发表重要讲话,2020/9/8 19:00,出席会议#高层动态#习近平活动报道专页
习近平在全国抗击新冠肺炎疫情表彰大会上发表重要讲话,2020/9/8 18:59,高层动态
【#全球新冠死亡病例超100万#】据约翰...,2020/9/29 8:59,
吉尔吉斯斯坦为新冠逝者举行全国哀悼,2020/7/31 17:41,国际要闻
苏格兰U19队主帅感染新冠 与英格兰比赛“半途而废”,2020/10/9 13:13,体育#滚动#国际足球#国家队
印尼新冠肺炎新增确诊病例4029例，累计突破40万例,2020/10/28 17:28,国际#徐伟#滚动新闻#亚太
美国多州住院新冠患者数创新高 纽约州放松防疫限制,2020/10/23 8:41,人民健康网
俄罗斯累计确诊新冠感染病例超过86万,2020/8/6 4:43,人民网俄罗斯分公司报道集#国际#消息#时政#滚动新闻#独家稿库#俄罗斯频道#滚动
部分重点人群接种新冠病毒疫苗（国务院联防联控机制发布会）,2020/12/20 9:28,要闻#健康#科教・社会#滚动新闻#新疆频道
世卫组织：全球累计新冠确诊病例达31664104例,2020/9/25 7:56,江西频道#国内国际
英国出台三级新冠警戒系统规范疫情防控,2020/10/13 10:45,国际#时政#滚动新闻#欧洲#全球抗疫进行时#英国频道
部分重点人群接种新冠病毒疫苗（国务院联防联控机制发布会）,2020/12/20 8:08,江西频道#国内国际
2月14日江苏无新增新冠肺炎确诊病例,2021/2/15 14:19,江苏频道#社会
世卫组织：全球累计新冠确诊病例达31664104例,2020/9/25 6:19,国际
西班牙去年三月废水样本中检出新冠病毒,2020/6/28 16:32,江苏频道#国内・国际
1月16日12时至24时辽宁无新增新冠肺炎确诊病例,2021/1/17 8:03,头条二
12月28日河南省新增新冠肺炎确诊病例1例,2020/12/29 8:34,河南频道
石家庄市新冠肺炎疫情防控工作第13场新闻发布会实录,2021/1/17 18:30,河北疫情防控#防控疫情，各地在行动#河北#坚决打赢疫情防控阻击战 河北在行动#健康#频道原创新闻#地方要闻#河北坚决打赢疫情防控阻击战#疫情防控新闻发布会#本网专稿#抗疫情#河北频道#石家庄#滚动新闻
美国众多人士强调新冠病毒源自自然界,2020/5/7 15:52,国际#环球#湖北频道#新闻中心#张隽
世卫组织：全球累计新冠确诊病例达41104946例,2020/10/23 9:01,人民健康网#健康舆情
北京新冠肺炎疫情在院病例全部清零,2020/8/26 16:43,滚动新闻#健康#北京频道#本网特稿#社会民生#疫情动态#本网原创#应对新型冠状病毒肺炎疫情 北京在行动
11月6日辽宁无新增新冠肺炎确诊病例,2020/11/7 8:10,头条二
习近平：在全国抗击新冠肺炎疫情表彰大会上的讲话,2020/10/15 15:18,党建#国内#人民战“疫”党旗飘扬#学习路上#高层动态#中央精神#党的建设数据库#讲话#讲话原文#学习路上数据库#2020年#全面建成小康社会#讲话#习近平活动报道专页#中央部署#社会
【#美国新冠肺炎超869万例#】#全球疫...,2020/10/27 7:03,
西班牙去年三月废水样本中检出新冠病毒,2020/6/28 12:53,国际
【#德国新增新冠肺炎150例#，累计新冠...,2020/3/7 16:54,
无锡抗击新冠肺炎疫情受表彰代表亲历光荣时刻,2020/9/9 23:17,焦点大图#江苏频道#政治#无锡新闻#科教文卫#无锡要闻#图片新闻
西宁市新冠肺炎疫情防控处置工作指挥部通告（第10号）,2020/10/26 9:56,青海要闻#科教文卫#青海频道#滚动新闻
国务院应对新冠肺炎疫情联防联控机制吉林工作组到吉林省指导工作,2021/1/18 8:45,吉林频道#每日头条
部分重点人群接种新冠病毒疫苗（国务院联防联控机制发布会）,2020/12/20 7:38,国际国内
韩国单日新增新冠病例数创5个多月来最高纪录,2020/8/20 16:31,国际
印尼新冠肺炎新增确诊病例4094例，累计324658例,2020/10/10 10:04,滚动新闻#徐伟#独家稿库#亚太#国际
天津市第139例本土新冠肺炎确诊病例病毒全基因组测序结果公布,2020/11/11 14:33,民生舆情#崔新耀#天津频道#今日天津#陶建#滚动播报：天津全力做好新冠肺炎疫情防控工作#本网原创
世卫组织：全球累计新冠确诊病例达41104946例,2020/10/23 8:25,要闻#上海频道#国际#滚动新闻#美食| 健康
世卫组织：全球累计新冠确诊病例达38789204例,2020/10/17 8:31,国际要闻
俄罗斯首款新冠疫苗已获国家注册,2020/8/12 13:04,国际
约翰斯・霍普金斯大学：美国累计新冠确诊病例超900万例,2020/10/31 8:11,国际
谭德塞：“获得抗击新冠肺炎工具加速器”资金缺口达350亿美元,2020/9/11 22:24,国际#滚动新闻#全球抗疫进行时#环球人物
世卫：全球新冠确诊病例突破1400万例,2020/7/20 16:05,图片影像#国际资讯#北京频道
现有证据表明新冠病毒起源自动物,2020/4/22 18:30,健康舆情#人民健康网
俄卫生部长：暂无计划组织儿童接种新冠疫苗,2020/8/29 4:15,人民网俄罗斯分公司报道集#消息#国际#时政#俄罗斯频道#滚动#滚动新闻#独家稿库
将对十七省份开展秋冬季新冠肺炎疫情防控专项督查,2020/9/19 16:00,人民健康网#人民日报
新冠病房的病号服床单如何消毒？,2020/5/6 16:44,四川频道#卫生
约翰斯・霍普金斯大学：美国累计新冠确诊病例超1200万例,2020/11/22 9:21,国际
辽宁新增1例本土新冠肺炎确诊病例 为大连报告,2020/12/19 8:48,人民健康网#地方报道
11月11日辽宁无新增新冠肺炎确诊病例,2020/11/12 8:38,头条二
将对十七省份开展秋冬季新冠肺炎疫情防控专项督查,2020/9/19 8:00,统战要闻
约翰斯・霍普金斯大学：全球累计新冠确诊病例超3000万例,2020/9/18 15:52,江西频道#国内国际
世卫组织：全球累计新冠确诊病例达31425029例,2020/9/24 6:26,国际
探访北京地坛医院新冠隔离病房,2020/6/17 17:07,江西频道#高清图库
新冠病毒侵入白宫“核心圈”,2020/5/11 19:14,人民健康网#健康舆情
世卫组织：全球累计新冠确诊病例达40665438例,2020/10/22 8:32,美食| 健康#国际#滚动新闻#要闻#上海频道
烟台市开发区一宗汽车零部件外包装标本新冠病毒核酸检测结果阳性,2021/1/2 9:38,滚动新闻#要闻#山东频道
1月14日0时至12时辽宁无新增新冠肺炎确诊病例,2021/1/14 15:36,头条二
伊朗：新冠确诊病例累计超过26万,2020/7/15 17:13,国际
成都市新冠病毒核酸检测机构达到127家,2020/11/16 8:13,新闻资讯#卫生
英媒：印度新冠疫情直逼美国 实地情况或比想象的更糟糕,2020/9/25 8:42,国际
全球累计新冠确诊病例超过2000万例,2020/8/11 16:37,国际#滚动新闻#全球抗疫进行时#每日全球疫情要览
金华市新冠肺炎疫情防控办公室1号通告,2021/1/19 9:00,最新消息
1月14日12时至24时辽宁无新增新冠肺炎确诊病例,2021/1/15 7:57,头条二
将对十七省份开展秋冬季新冠肺炎疫情防控专项督查,2020/9/19 15:56,关喜艳#湖北频道#新闻中心#环球#国内
日本累计新冠确诊超11万 政府专家小组献“紧急提议”,2020/11/11 16:28,中日万象
辽宁新增6例本土新冠肺炎确诊病例 大连报告5例,2020/12/28 8:39,人民健康网#地方报道
外交部：新冠病毒溯源须由科学家在世界范围内开展调查研究,2020/12/18 18:40,国际#2020年外交部发言人讲话#滚动新闻#亚太
世卫组织：全球累计新冠确诊病例达40665438例,2020/10/22 8:10,滚动新闻#全球抗疫进行时#国际
日本25日新增确诊病例1076例 再次发现8例变异新冠病毒确诊病例,2021/2/26 11:15,东京速递#独家报道#社会#滚动新闻#独家稿库#日本频道#编译#滚动新闻#国际
美国新冠肺炎确诊659万 死亡超19.5万,2020/9/16 16:47,国际#美洲#张梦旭#全球抗疫进行时#滚动新闻#独家稿库
日媒：新冠疫情扩散 日本家中疗养者增至六千余人,2020/12/8 9:47,日本频道#社会#滚动新闻
美媒：报告显示新冠疫情加剧美国贫富差距,2020/9/23 17:43,美国频道
联合国纪念2020年世界哲学日 鼓励对新冠危机的哲学思考,2020/11/21 9:17,滚动新闻#独家稿库#国际#人民网驻联合国记者报道集
日本男子组合“Snow Man”成员确诊感染新冠 退出“红白歌会”,2020/12/25 14:34,独家报道#滚动新闻#日本频道#东京速递#独家稿库#滚动新闻#编译#娱乐#国际
乌兰县新冠肺炎疫情防控指挥部办公室组织召开工作会议,2021/1/21 16:13,魅力新乌兰#青海频道#滚动新闻
甘肃疾控：严防新冠肺炎 继续做好个人防护,2020/11/6 15:22,健康
将对十七省份开展秋冬季新冠肺炎疫情防控专项督查,2020/9/19 14:35,国际国内
武汉新冠肺炎重症病例实现清零,2020/4/25 19:15,国内
世卫组织：全球累计新冠确诊病例达39596858例,2020/10/19 9:06,国际要闻
关于开展秋冬季新冠肺炎疫情风险排查工作的通知,2020/10/12 23:32,省内要闻#黑龙江频道#【权威发布】黑龙江省全力做好新型冠状病毒肺炎疫情防控工作#赵怡
福奇：未全面“关闭”是近期美国新冠病例激增主要原因,2020/8/3 18:58,美国频道#滚动新闻#聚焦美国
澳研究者开发15分钟新冠检测方法 将有效追踪接触者,2020/10/20 22:48,澳新频道#滚动#社会|科技
AI算法可快速诊断新冠肺炎患者,2020/5/21 16:32,医学・健康#AI医疗#科技#人工智能频道
日本累计新冠确诊超11万 政府专家小组献“紧急提议”,2020/11/11 8:27,滚动新闻#日本频道#社会
英国新冠病毒疫苗临床试验取得初步进展,2020/7/21 21:45,英国频道
三州新冠病例超百万，美疾控机构却欲缩短隔离时间,2020/12/2 9:17,人民健康网
【#31省区市新增确诊8例#】#新冠肺炎...,2020/11/13 7:58,
世卫组织：全球累计新冠确诊病例达39023292例,2020/10/18 8:25,国内国际#江西频道
世卫组织：全球累计新冠确诊病例达40251950例,2020/10/21 9:36,国际#滚动新闻#美食| 健康#要闻#上海频道
受试者出现病症 强生暂停新冠疫苗试验,2020/10/14 8:32,人民健康网#健康舆情
世卫组织：全球累计新冠确诊病例达39023292例,2020/10/18 6:27,国际#其他#滚动新闻
湖北新增新冠肺炎确诊病例0例,2020/8/4 19:46,湖北频道#热点专题#聚焦新型冠状病毒性肺炎#新闻中心#本网原创#关喜艳
孟加拉国累计新冠死亡病例超3500例,2020/8/13 17:26,南亚东南亚视窗
昆明发现境外输入新冠肺炎确诊病例后续：3816份核酸检测样本均为阴性,2020/12/27 0:05,社会
个案研究证明新冠病毒或可经胎盘母婴传播,2020/7/20 18:17,科技#医学健康
文博战线抗击新冠肺炎疫情主题展在陕历博开展,2020/9/25 21:47,西安
2月3日上海新增3例本土新冠肺炎确诊病例，常住黄浦区、宝山区,2021/2/4 9:34,滚动新闻#频道记者自创稿件#马作鹏#上海频道#原创稿库
我国新冠疫苗接种量超一千五百万人次（国务院联防联控机制发布会）,2021/1/21 10:28,社会#要闻#时政#吉林频道
世卫组织欧洲办事处呼吁协调合作应对新冠疫情反弹,2020/9/18 17:06,国际
我国新冠疫苗接种量超一千五百万人次（国务院联防联控机制发布会）,2021/1/21 9:45,青海频道#滚动新闻#社会
11月9日辽宁无新增新冠肺炎确诊病例,2020/11/10 8:02,头条二
非洲新冠确诊病例超30万,2020/6/23 5:02,国际#非洲#全球抗疫进行时#滚动新闻
台湾连续5天出现新冠肺炎确诊病例,2020/10/9 20:28,台湾新闻滚动#台湾频道#岛内万象
关于抗击新冠肺炎疫情国家级表彰拟表彰对象的公示,2020/8/28 16:28,综合报道
日本单日新增新冠病例400多例 自卫队多人确诊,2020/10/5 9:18,国际
1月16日0时至12时辽宁无新增新冠肺炎确诊病例,2021/1/16 15:40,头条二
昨天上海无新增本地新冠肺炎确诊病例，新增1例境外输入病例,2021/3/6 8:46,滚动新闻#社会| 法治#上海频道#要闻
1月19日0时至12时辽宁无新增新冠肺炎确诊病例,2021/1/19 16:42,头条二
3月31日江苏新增境外输入新冠肺炎确诊病例2例 均为意大利输入,2021/4/1 11:23,江苏频道#社会
做好新疆中风险地区新冠疫情输入防范应对工作,2020/12/15 8:10,宁夏要闻
孟加拉国累计新冠死亡病例超3500例,2020/8/13 17:52,国际要闻
部分重点人群接种新冠病毒疫苗（国务院联防联控机制发布会）,2020/12/20 9:33,时事・财经#要闻聚焦#编辑稿件统计#潘惠文#人民网海南频道
使命在肩――国务院应对新冠肺炎疫情联防联控机制吉林工作组与吉林省医疗队共抗疫情侧记,2021/2/1 10:48,吉林频道#社会#民生
北京12月27日新增1例境外输入新冠肺炎确诊病例,2020/12/28 8:13,滚动新闻#北京频道#本网特稿#疫情动态#应对新型冠状病毒肺炎疫情 北京在行动#本网原创
匈牙利新冠疫情加速蔓延 累计确诊超4万,2020/10/14 20:03,滚动新闻#欧洲#全球抗疫进行时#国际
湖北推出新冠肺炎康复门诊,2020/4/22 16:39,人民健康网#健康舆情
武汉新冠肺炎重症病例实现清零,2020/4/25 16:22,国内国际#江西频道#高清图库
济南通报北京两例新冠肺炎确诊病例在济活动轨迹 曾到过莱芜,2021/1/21 11:09,滚动新闻#济南#山东频道
关于表彰全国抗击新冠肺炎疫情先进个人和先进集体的决定,2020/9/9 17:00,周恬#重点推荐#新闻中心#环球#湖北频道#国内
智利：收治新冠患者的方舱医院落成,2020/5/26 16:47,国际
东京奥组委再次有员工确诊感染新冠病毒,2020/10/17 10:46,体育#综合#东京奥运会推迟至2021年#滚动
3月7日江苏新增境外输入新冠肺炎确诊病例1例,2021/3/8 13:12,社会#江苏频道
法国新增新冠死亡病例83例,2020/5/14 16:50,国际
中国驻欧盟使团发言人驳斥欧洲议会关于新冠疫情的不当涉华言论,2020/11/27 9:35,国际#滚动新闻#独家稿库#欧洲#郑彬
世卫组织：全球累计新冠确诊病例达30949804例,2020/9/22 14:25,国际
意大利确诊数超70万 米兰新冠医院3分钟增加1例确诊,2020/11/3 8:34,人民健康网
埃及新冠确诊病例超过5万例,2020/6/19 17:12,国际
义安区一人荣获抗击新冠肺炎疫情全国三八红旗手称号,2020/10/10 15:13,安徽新闻列表#县区动态#铜陵要闻
1月13日12时至24时辽宁无新增新冠肺炎确诊病例,2021/1/14 8:04,头条二
巴西新冠确诊病例超160万,2020/7/6 21:25,滚动新闻#国际#美洲
美加研究显示羟氯喹难防新冠感染,2020/6/5 16:53,滚动新闻#美洲#国际
中科院研究员：新冠疫情很难说在短期内结束,2020/4/24 3:06,科技
美国新冠疑云 世界需要答案,2020/5/15 1:03,美国频道
2020年12月13日湖北省新增新冠肺炎确诊病例0例,2020/12/14 8:47,新闻中心#湖北各地#湖北频道#湖北要闻#重点推荐#周恬
澳发明20分钟新冠病毒血液检测方法,2020/7/21 17:14,网摘#浙江频道
云南省抗击新冠肺炎疫情先进集体、个人载誉归来,2020/9/9 16:28,要闻
昨天上海无新增本地新冠肺炎确诊病例，新增3例境外输入病例,2021/2/24 9:11,上海频道
亚美尼亚总理确诊感染新冠病毒,2020/6/2 5:16,国际#滚动新闻
日本联赛鸟栖砂岩队又有两人确诊新冠,2020/8/14 0:00,中日万象
兰州进口冷链食品新冠病毒检测阳性事件尚未发现本地感染者,2020/11/15 8:39,甘肃要闻#最新通报#最新资讯
11月3日辽宁无新增新冠肺炎确诊病例,2020/11/4 8:37,头条二
1月8日12时至24时辽宁新增2例本土新冠肺炎确诊病例,2021/1/9 8:06,头条二
黎巴嫩新冠病例激增 卫生部长说急需“封城”,2020/8/19 16:41,滚动新闻#全球抗疫进行时#时事快报#中东#国际#黎巴嫩首都贝鲁特港口区发生爆炸
意大利 新冠治愈病例大幅增加,2020/6/26 16:09,人民健康网
卢旺达发生首例新冠肺炎死亡病例,2020/6/3 4:25,上海频道#要闻#滚动新闻
关于印发四川省2021年新冠肺炎疫情防控工作指南（第一版）的通知,2021/1/10 14:52,最新消息
世卫组织：关于新冠病毒的传言与事实,2020/4/17 16:45,人民健康网#食品#科普知识
巴西总统博索纳罗最新新冠病毒检测结果仍呈阳性,2020/7/23 16:59,国际
孟加拉国新冠累计确诊病例超20万,2020/7/19 19:05,国际#滚动新闻#亚太#全球抗疫进行时
世卫组织确定新冠病毒源自自然界,2020/5/3 16:27,滚动新闻#人民健康网#本网原创
澳门特区政府对防范新冠肺炎疫情作出一系列应对部署,2020/10/20 8:39,港澳新闻滚动#港澳#港澳生活
部分重点人群接种新冠病毒疫苗（国务院联防联控机制发布会）,2020/12/20 8:43,人民日报#人民健康网#健康舆情
俄罗斯累计确诊新冠感染病例超过86万,2020/8/7 0:49,国际#人民网俄罗斯分公司报道集#消息#独家稿库#俄罗斯频道#滚动#社会#滚动新闻
印尼新冠肺炎新增确诊病例4369例 累计突破38万例,2020/10/23 19:57,国际#滚动新闻#徐伟#独家稿库#亚太#全球抗疫进行时
比利时和卢森堡弃用羟氯喹治疗新冠肺炎,2020/5/28 19:19,国际・军事
部分重点人群接种新冠病毒疫苗（国务院联防联控机制发布会）,2020/12/20 10:01,青海频道#滚动新闻#社会
芬兰国际机场将部署嗅探犬探测新冠病毒,2020/9/24 16:08,图片频道#滚动图片新闻#国际图片#高清
新闻分析：新冠确诊超7万 日本为何越来越淡定,2020/9/5 17:18,滚动新闻#社会#日本频道
我国第八版新冠肺炎诊疗方案发布,2020/8/20 16:46,国内要闻
俄单日新增新冠感染者超2万 创下单日新增人数新高,2020/11/7 10:07,国际
世卫组织：全球累计新冠确诊病例达38789204例,2020/10/17 9:52,国际
部分重点人群接种新冠病毒疫苗（国务院联防联控机制发布会）,2020/12/20 8:17,湖北频道#环球#张隽#新闻中心#国内
部分重点人群接种新冠病毒疫苗（国务院联防联控机制发布会）,2020/12/20 7:53,国内#滚动新闻#要闻#陕西频道
