标题,发表时间,来源
深圳新冠疫苗全面开打,2021/3/30 8:36,要闻#深圳频道#健康#快讯
普京接种新冠疫苗,2021/3/24 7:54,国际#滚动新闻#全球抗疫进行时
新冠疫苗运抵港澳,2021/3/1 8:08,滚动新闻#健康・生活
让新冠疫苗真正成为“人民的疫苗”,2021/3/28 8:41,滚动新闻#政府声音#健康・生活
国产新冠疫苗是安全有效的（大健康观察・新冠疫苗来了①）,2021/1/12 8:43,社会#国内国际#江西频道
斯里兰卡：接种新冠疫苗,2021/2/21 9:24,南亚东南亚视窗
新冠疫苗接种“20问”,2021/3/26 8:37,黑龙江频道#王思迪#省内要闻#科普龙江#龙江头条
新冠疫苗运抵港澳,2021/3/1 8:07,科教文卫#港澳内地#港澳#港澳新闻滚动#时政新闻
南非开始新冠疫苗接种,2021/2/18 8:59,国际#滚动新闻#非洲#全球抗疫进行时
美国新冠肺炎确诊2981万 新冠疫苗接种凸显不平等,2021/3/22 8:16,滚动新闻#独家稿库#全球抗疫进行时#李志伟#国际#美洲
印度尼西亚：接种新冠疫苗,2021/3/11 8:19,南亚东南亚视窗
玻利维亚开始新冠疫苗接种,2021/1/30 9:02,滚动新闻#欧洲#国际
他们为何选择中国新冠疫苗,2021/1/25 11:23,教育| 科技#滚动新闻#上海频道
新西兰将开始接种新冠疫苗,2021/2/18 11:17,澳新频道#滚动#社会|科技
斯洛文尼亚悼念新冠逝者,2021/3/15 13:44,国际#欧洲#滚动新闻
合肥各地预约接种新冠疫苗,2021/3/17 8:41,图说天下#安徽新闻列表
第二批中国新冠疫苗运抵阿根廷,2021/4/2 10:29,国际
中国新冠疫苗安全吗？有效吗？够用吗？,2021/1/27 7:54,人民健康网
新冠病毒“极不可能”通过实验室传人！,2021/4/1 9:12,健康・生活#滚动新闻#政策声音
武汉发布新冠疫苗接种倡议书,2021/3/27 21:10,本网原创#湖北要闻#周恬#民生万象#社会民生#新闻中心#湖北频道#湖北各地
接种中国新冠疫苗,2021/1/24 7:42,关喜艳#国际#湖北频道#新闻中心#环球
科普：新冠病毒“极不可能”通过实验室传人,2021/3/31 8:55,经济・科技
他们为何选择中国新冠疫苗,2021/1/25 8:21,科技
尼泊尔：接种新冠疫苗,2021/1/28 8:16,南亚东南亚视窗
新冠病毒“极不可能”通过实验室传人！,2021/4/1 8:41,国内国际#江西频道
全球新冠疫情是否已到“拐点”,2021/3/4 15:15,健康
国产新冠疫苗是安全有效的（大健康观察・新冠疫苗来了①）,2021/1/12 8:54,四川频道#卫生
非洲多国陆续收到新冠疫苗,2021/3/9 19:18,国际#滚动新闻#非洲
新冠病毒极不可能通过实验室传人,2021/3/31 16:32,滚动新闻#全球抗疫进行时#国际
云南瑞丽有序开展新冠疫苗接种,2021/4/2 7:59,河南频道
英国：设立国家新冠纪念墙,2021/4/2 8:36,健康・生活#滚动新闻#行业热点
中国-世卫组织新冠病毒溯源联合研究报告：新冠病毒经中间宿主引入人类“比较可能”到“非常可能”,2021/3/30 22:25,国际
合肥市新冠疫苗免费接种,2021/3/22 8:29,安徽新闻列表#图说天下
印尼发布新冠疫苗主题邮票,2021/2/27 9:30,南亚东南亚视窗
美国新冠肺炎确诊2877万 纽约、加州发现本土新冠病毒变异毒株,2021/3/4 8:41,美洲#国际#李志伟#独家稿库#全球抗疫进行时#滚动新闻
新冠病毒疫苗接种十大热点问题，江苏省新冠肺炎疫情防控组专家解答来了,2021/3/25 21:23,民生#江苏频道
新冠病毒疫苗接种有哪些注意事项？,2021/3/19 9:08,青海频道#滚动新闻#青海要闻#科教文卫
匈牙利开始接种中国新冠疫苗,2021/2/25 9:02,滚动新闻#欧洲#全球抗疫进行时#国际
宜兴：接种新冠病毒疫苗,2021/3/25 9:59,宜兴
澳大利亚启动新冠疫苗接种,2021/2/22 8:42,国际#滚动新闻#亚太#全球抗疫进行时
江苏各地全面启动新冠疫苗接种预约,2021/3/24 11:36,江苏要闻#江苏频道#民生
重组新冠疫苗获批紧急使用,2021/3/22 8:30,健康・生活#滚动新闻#行业热点
延吉市民积极接种新冠肺炎疫苗,2021/3/26 9:38,吉林频道#魅力延吉视窗
深圳全面开展新冠疫苗接种工作,2021/3/30 8:33,湾区生活#广东频道#深圳#健康#滚动#本地#粤港澳大湾区#地市
新冠易感人群该如何有效防治,2021/1/8 8:22,科普知识#人民健康网
美国新冠肺炎确诊超2894万 变异新冠病毒在美快速传播,2021/3/7 9:16,滚动新闻#李志伟#独家稿库#国际#美洲
尼日尔启动接种中国援助新冠疫苗,2021/3/30 7:52,国际#全球抗疫进行时#滚动新闻#非洲
丹麦暂停接种阿斯利康新冠疫苗,2021/3/12 8:43,国际#全球抗疫进行时#滚动新闻#欧洲
天津市民有序接种新冠疫苗,2021/3/24 11:25,今日天津#天津频道#图片新闻
首批中国科兴新冠疫苗运抵萨尔瓦多,2021/3/29 8:27,国际#滚动新闻
新冠易感人群该如何有效防治,2021/1/8 9:10,健康
第四批中国新冠疫苗运抵智利,2021/2/27 9:55,国际图片#高清#滚动图片新闻#图片频道
马耳他继续收紧新冠防疫措施,2021/3/29 10:37,滚动新闻#国际
新冠病毒会通过食品传播吗,2021/1/27 10:49,人民健康网
江苏各地积极推进新冠病毒疫苗接种,2021/3/25 21:24,社会#江苏频道
爱沙尼亚总理新冠病毒检测结果呈阳性,2021/3/16 8:21,国际#滚动新闻#欧洲#全球抗疫进行时
郑州多平台开始登记新冠疫苗接种意愿 暂不推荐18岁以下人群接种新冠疫苗,2021/3/31 8:18,河南频道
法国：设立新冠疫苗接种中心,2021/4/2 8:37,健康・生活#滚动新闻#行业热点
秘鲁启动新冠疫苗接种,2021/2/10 8:32,美洲#国际#滚动新闻
新研究：中国及时采取新冠防控措施有效降低新冠病例数,2020/11/25 8:23,国际#滚动新闻#亚太#全球抗疫进行时
菲律宾新冠疫情呈现反弹趋势,2021/3/12 8:23,南亚东南亚视窗
预防新冠肺炎，打疫苗最主动有效,2021/1/27 9:59,人民健康网#健康舆情
巴基斯坦：接种中国新冠疫苗,2021/2/5 8:40,南亚东南亚视窗
同济医务人员集中接种新冠疫苗,2021/3/27 9:30,新闻中心#湖北频道#周恬#社会民生#民生万象
北京：新冠疫苗校园接种进行时,2021/3/25 8:26,图片频道#国内图片#滚动图片新闻#高清
科普：新冠病毒对儿童有哪些影响,2021/2/1 9:45,人民健康网
第二款新冠疫苗在澳大利亚批准使用,2021/2/17 14:01,国际#消息#澳新频道#滚动#滚动新闻#独家稿库#社会|科技
中国-世卫组织新冠病毒溯源联合研究报告：新冠病毒通过实验室引入人类“极不可能”,2021/3/30 22:24,国际
首批科兴新冠疫苗运抵香港,2021/2/20 8:01,国内国际#江西频道
瓜伊多感染新冠　症状轻微,2021/3/29 8:31,滚动新闻#国际#美洲
甘肃省新冠病毒疫苗可预约接种,2021/3/25 9:01,医疗#地方领导#新闻中心#访问量#各地新闻
南极洲首现新冠病例,2020/12/24 9:54,人民健康网#健康舆情
过敏患者可以接种新冠疫苗吗？,2021/1/23 9:19,防疫课堂#人民健康网
中国新冠疫苗运抵多米尼加,2021/2/24 15:06,国际#非洲#滚动新闻
首批科兴新冠疫苗运抵香港,2021/2/20 8:01,行业热点#滚动新闻#健康・生活
阿根廷紧急批准使用中国新冠疫苗,2021/2/22 15:18,滚动新闻#国际
墨西哥开始新冠疫苗接种,2020/12/25 8:50,国际#美洲#滚动新闻#全球抗疫进行时
新冠疫苗三问,2020/10/22 11:09,智斗新型冠状病毒肺炎#权威发布
科普：新冠病毒“极不可能”通过实验室传人――解读中国-世卫组织新冠病毒溯源联合研究报告,2021/3/31 2:36,健康・生活
青海省安全有序开展新冠病毒疫苗接种工作,2021/3/31 11:56,科教文卫#青海要闻#青海频道#滚动新闻
美国日增新冠确诊病例显著下降,2021/3/16 16:29,滚动新闻#美洲#国际
暂时无法接种新冠疫苗？可以这样保护自己,2021/1/19 8:15,人民网原创#科普中国#刘子若#乐享健康#热点解读#图文原创平台#总图文原创
摩洛哥：接种中国新冠疫苗,2021/2/1 10:30,趣闻趣图
智利开始新冠疫苗接种,2020/12/25 8:43,滚动新闻#全球抗疫进行时#国际#美洲
疾控专家解答新冠疫苗十一问,2021/3/28 8:19,社会法治#编辑稿件统计#海南新闻#人民网海南频道#卢少雄
科普：新冠病毒“极不可能”通过实验室传人――解读中国-世卫组织新冠病毒溯源联合研究报告,2021/3/31 5:59,深度报道#国际#滚动新闻#全球抗疫进行时
印度尼西亚：接种新冠疫苗,2021/1/29 8:54,南亚东南亚视窗
新西兰启动大规模新冠疫苗接种,2021/2/22 8:47,澳新频道#社会|科技#滚动
新冠疫苗如何接种？有哪些流程？记者实地探访,2021/3/24 8:37,湖南要闻
这些新冠疫苗传闻是谣言,2020/12/9 8:53,滚动#本地#健康#广东频道
菲律宾累计1.5万名警察感染新冠,2021/4/2 8:15,南亚东南亚视窗
多国订购中国新冠疫苗,2021/1/5 9:20,频道稿件编辑统计查询#采编人员信息统计#贵州频道#健康养生#郜林筱
开展新冠肺炎疫情防控培训,2021/1/20 10:45,频道稿件编辑统计查询#贵州卫体#采编人员信息统计#地方联播#贵州频道#郜林筱
美国开始新冠疫苗接种,2020/12/15 9:29,美国频道
中国科兴新冠疫苗运抵乌克兰,2021/3/26 7:55,全球抗疫进行时#滚动新闻#中外交流#国际
部分国家开始新冠疫苗接种,2020/12/11 8:28,健康舆情#人民健康网
新一批中国新冠疫苗运抵哥伦比亚,2021/3/21 16:05,国际
广州设置296个新冠疫苗接种单位,2021/3/25 8:49,广东频道#健康#本地#滚动#地市#广州
美国近320万儿童感染新冠,2021/3/3 12:21,国际
接种新冠肺炎疫苗“五项注意”,2021/1/27 10:02,人民健康网#健康舆情
美国开始新冠疫苗接种,2020/12/15 8:48,国际
江西省已接种新冠疫苗230.83万人次,2021/3/30 7:12,江西要闻#江西频道
巴西新冠死亡病例超30万,2021/3/25 10:33,美洲#国际#滚动新闻#全球抗疫进行时
海口约60万人已接种新冠疫苗,2021/3/23 7:52,编辑稿件统计#经济民生#海南新闻#人民网海南频道#人民网海口视窗#蒋成柳
有序开展新冠肺炎疫苗接种,2021/1/29 9:19,西秀时政#地方网群#频道稿件编辑统计查询#贵州频道#采编人员信息统计#吴锋#西秀视窗
印尼发行新冠疫苗主题邮票,2021/3/1 7:46,国际#滚动新闻#亚太#全球抗疫进行时
南昌可集体预约接种新冠疫苗,2021/3/18 7:29,南昌#江西频道#南昌要闻#社会#江西要闻
海南新冠疫苗接种打哪种？谁能打？怎么打？解答来了,2021/3/23 13:52,人民网海南频道#海南新闻#蒋成柳#经济民生#自采稿件库#王硕#本网专稿#编辑稿件统计
马来西亚启动新冠疫苗接种,2021/2/25 8:15,南亚东南亚视窗
法国扩大周末“禁足”范围以防控新冠疫情,2021/3/5 8:00,滚动新闻#欧洲#全球抗疫进行时#国际
印尼开始大规模接种新冠疫苗,2021/1/15 8:48,南亚东南亚视窗
揭开新冠病毒“恶魔”面纱,2021/2/2 8:16,人民健康网#健康舆情
多米尼加宣布新冠疫苗接种计划,2021/2/16 9:06,滚动新闻#国际#美洲
新加坡开始新冠疫苗接种,2020/12/30 15:52,滚动新闻#亚太#国际
新冠疫苗三问,2020/10/21 8:41,医学健康#科技
缅甸正式展开新冠疫苗接种,2021/1/28 8:16,南亚东南亚视窗
匈牙利：中国新冠疫苗获准使用,2021/1/31 8:35,湖北频道#环球#张隽#新闻中心#国际
海口约60万人已接种新冠疫苗,2021/3/23 8:28,访问量#各地新闻#新闻中心#地方领导
吉尔吉斯斯坦开始接种中国新冠疫苗,2021/3/30 8:15,滚动新闻#欧洲#全球抗疫进行时#国际
新冠疫苗三问,2020/10/21 8:32,健康舆情#人民健康网
贵安启动高校新冠疫苗接种工作,2021/4/2 9:25,贵州频道#贵安新区视窗#贵州文教#采编人员信息统计#郜林筱#领导之窗#贵州卫体#频道稿件编辑统计查询#地方网群#教育在线
中国援助的新冠疫苗抵达圭亚那,2021/3/3 20:33,国际#滚动新闻
印尼：建造新冠临时隔离病房,2021/2/19 8:28,南亚东南亚视窗
新冠疫苗三问,2020/10/21 9:20,四川频道#时政
新冠疫苗三问,2020/10/21 8:31,江西频道#国内国际#社会
中国援助的第二批新冠疫苗运抵玻利维亚,2021/3/31 14:18,滚动新闻#全球抗疫进行时#国际#美洲
多国积极推进新冠疫苗接种,2021/1/14 6:05,国际
新冠病毒“极不可能”通过实验室传人！,2021/4/1 8:46,四川频道#时政
皇马确认齐达内感染新冠,2021/1/23 9:08,滚动#国际足球#体育#西甲#皇家马德里
匈牙利：中国新冠疫苗获准使用,2021/1/31 8:16,人民健康网
第二批科兴新冠疫苗抵达香港,2021/3/25 23:23,港澳
注射免疫球蛋白对新冠患者有效,2021/2/25 8:41,滚动新闻#健康・生活#医学前沿
匈牙利：中国新冠疫苗获准使用,2021/1/31 4:55,滚动新闻#全球抗疫进行时#欧洲#国际
台州市全面免费开放新冠疫苗接种,2021/3/12 8:43,地方#台州#浙江频道
中国援助尼日尔新冠疫苗运抵尼亚美,2021/3/22 11:30,国际
英国过半成年人已接种新冠疫苗,2021/3/22 8:24,健康・生活#政策声音#滚动新闻#行业热点
加蓬总统夫妇接种中国新冠疫苗,2021/3/25 8:43,国际#滚动新闻#非洲#全球抗疫进行时
马来西亚：新冠病毒检测进行时,2021/1/9 9:05,南亚东南亚视窗
中国新冠疫苗助力多国抗疫,2021/1/23 8:16,人民日报#人民健康网
菲律宾发现P.3变异新冠病毒,2021/3/14 9:16,国际#滚动新闻#亚太#全球抗疫进行时
中国援埃塞俄比亚新冠疫苗抵达亚的斯亚贝巴,2021/3/31 13:40,滚动新闻#中外交流#全球抗疫进行时#国际
新冠病毒“换装”意味着什么,2020/12/25 10:19,人民健康网#地方报道
中国援助伊拉克的新冠疫苗运抵巴格达,2021/3/2 16:51,滚动新闻#国际
美国新冠肺炎死亡病例超过五十万,2021/2/25 5:38,国际
沈阳新冠肺炎患者得到有效救治,2021/1/8 13:53,人民健康网#健康舆情
芬兰研发出鼻喷式新冠疫苗,2021/3/9 14:37,国际#滚动新闻#欧洲#全球抗疫进行时
首批科兴新冠疫苗运抵香港,2021/2/19 19:16,港澳#港澳新闻滚动
中国援柬埔寨新冠疫苗运抵金边,2021/4/1 16:33,国际#中外交流#滚动新闻#全球抗疫进行时
普京宣布将于今日接种新冠疫苗,2021/3/23 17:01,滚动新闻#独家稿库#俄罗斯频道#滚动#国际#人民网俄罗斯分公司报道集#消息#时政
南太瓦利斯和富图纳报告首例新冠死亡病例,2021/3/22 14:54,全球抗疫进行时#滚动新闻#亚太#国际
首批科兴新冠疫苗运抵香港,2021/2/20 8:11,国内#湖北频道#新闻中心#环球#关喜艳
新冠疫苗接种十问十答,2021/1/8 8:36,人民健康网#地方报道
4款国产新冠疫苗附条件上市,2021/3/1 8:38,健康・生活#滚动新闻
斯里兰卡批准中国国药新冠疫苗紧急使用,2021/3/20 15:23,国际#滚动新闻
部分在江苏台湾同胞接种新冠疫苗,2021/3/1 7:10,江苏频道#社会
重庆614个点保障新冠疫苗接种,2021/3/28 8:45,头图
英国开始接种新冠疫苗,2020/12/9 8:48,国际
首批中国新冠疫苗运抵阿根廷,2021/2/26 15:08,美洲#国际#独家稿库#全球抗疫进行时#滚动新闻#消息
新西兰启动大规模新冠疫苗接种,2021/2/20 13:46,国际#滚动新闻#全球抗疫进行时#亚太
首批科兴新冠疫苗运抵香港,2021/2/20 5:13,港澳#人民日报报系涉港澳报道集#港澳新闻滚动#时政新闻
马来西亚开始接种科兴新冠疫苗,2021/3/18 20:51,亚太#滚动新闻#国际
我国已接种新冠疫苗7495.6万剂次,2021/3/22 8:29,政策声音#滚动新闻#健康・生活
菲总统发言人新冠检测呈阳性,2021/3/16 8:45,南亚东南亚视窗
马耳他多措并举加强新冠疫情防控,2021/3/5 8:11,欧洲#全球抗疫进行时#滚动新闻#国际
新冠病毒疫苗可在大范围人群形成有效保护,2021/1/17 9:46,人民健康网
江苏各地有序推进新冠病毒疫苗接种,2021/3/26 7:11,江苏要闻#江苏频道#民生
西班牙人新冠疫苗接种意愿高,2021/2/27 8:40,国际#欧洲#滚动新闻#全球抗疫进行时
我国科学家揭示新冠肺炎免疫学特征,2021/2/9 8:05,健康・生活#滚动新闻#行业热点
第三批中国科兴新冠疫苗运抵墨西哥,2021/3/14 9:44,国际
全免费 上海加快实施新冠疫苗接种,2021/3/17 10:07,上海频道#要闻#滚动新闻
巴西宣布正式开始新冠疫苗接种,2021/1/19 8:58,全球抗疫进行时#滚动新闻#美洲#国际
巴西发现新型变异新冠病毒,2021/1/18 10:09,人民健康网
江苏：有序开展新冠疫苗接种,2021/1/22 8:25,滚动图片新闻#高清#图片频道#国内图片
首批中国新冠疫苗运抵乌兹别克斯坦,2021/3/28 6:14,国际
日本新冠确诊病例超46万例,2021/3/25 16:36,中日万象
九龙坡新冠疫苗临时接种点启用,2021/3/26 18:17,区县
广州市接种新冠疫苗人数超百万,2021/3/28 8:53,行业热点#滚动新闻#健康・生活#地方报道
中国援柬第二批新冠疫苗运抵金边,2021/4/1 13:13,国际#滚动新闻#亚太
澳大利亚正式启动新冠疫苗接种,2021/2/22 8:32,滚动#滚动新闻#澳新频道#社会|科技#独家稿库#国际#消息
【#吴尊友解读新冠病毒环境传人#：#新冠...,2020/12/20 19:23,
澳门市民开始接种第二剂国产新冠疫苗,2021/3/23 8:13,港澳生活#港澳#港澳新闻滚动
接种新冠疫苗 建立免疫屏障,2021/3/19 8:12,健康・生活#滚动新闻
日本出现首例变异新冠病毒死亡病例,2021/3/16 16:45,编译#国际#滚动新闻#独家报道#滚动新闻#独家稿库#日本频道#东京速递#社会
多国积极推进新冠疫苗接种,2021/1/14 7:55,国际#湖北频道#新闻中心#环球#张隽
首批中国新冠疫苗运抵匈牙利,2021/2/18 8:34,滚动新闻#健康・生活
温州：瑞安上线新冠疫苗预约平台,2021/3/23 8:24,浙江频道#温州#地方
日本累计新冠死亡病例数超9000,2021/3/29 16:20,中日万象
美网冠军教练感染新冠,2021/1/18 7:39,网球#滚动#体育#综合
俄总理：俄罗斯新冠疫情逐步稳定,2021/3/25 16:34,时政#消息#人民网俄罗斯分公司报道集#滚动新闻#独家稿库#俄罗斯频道#滚动
新一批中国新冠疫苗运抵哥伦比亚,2021/3/21 13:47,国际#全球抗疫进行时#滚动新闻
中国援助的新冠疫苗运抵津巴布韦,2021/2/16 8:25,湖北频道#环球#新闻中心#国际#周恬
斯里兰卡批准中国国药新冠疫苗紧急使用,2021/3/21 5:32,国际
白俄罗斯开始接种中国援助的新冠疫苗,2021/3/17 8:23,河南频道
中国国药集团新冠疫苗运抵玻利维亚,2021/4/1 8:21,健康・生活#行业热点#滚动新闻
中国援助的新冠疫苗运抵津巴布韦,2021/2/16 5:31,国际
辽宁省疾控专家详解新冠疫苗接种“知识点”,2021/4/2 8:05,要闻
印尼官方称目前使用的新冠疫苗对变异病毒有效,2021/3/5 8:44,南亚东南亚视窗
哥伦比亚启动新冠疫苗接种工作,2021/2/18 8:58,国际#美洲#滚动新闻#全球抗疫进行时
云南瑞丽全面启动新冠疫苗接种,2021/4/2 7:30,国内国际#江西频道
云南瑞丽全面启动新冠疫苗接种,2021/4/2 7:21,健康・生活
美动物园：大猩猩接种新冠疫苗后情况良好,2021/3/10 9:44,国际#美洲#全球抗疫进行时#滚动新闻
韩国增购2300万人份新冠疫苗,2021/2/18 8:47,社会#专题#韩国频道#抗击新冠肺炎疫情#滚动
莫斯科继续扩大可接种新冠疫苗人员范围,2021/1/4 10:09,频道稿件编辑统计查询#国际要闻#吴锋#贵州频道#采编人员信息统计
新冠疫苗当打则打 别被这些谣言误导,2021/2/5 9:37,健康
云南瑞丽全面启动新冠疫苗接种,2021/4/2 11:22,江苏频道#国内・国际
中国援助的新冠疫苗运抵津巴布韦,2021/2/15 19:24,国际
几内亚启动接种中国援助新冠疫苗,2021/3/6 9:21,国际#滚动新闻#非洲#全球抗疫进行时
新冠患者随访研究揭示了什么,2021/1/19 8:38,人民健康网#健康舆情
英首相说变异新冠病毒致死率“可能更高”,2021/1/24 9:33,国际#云南频道
巴基斯坦总理新冠病毒检测呈阳性,2021/3/20 22:56,国际
别犹豫，对新冠肺炎疫苗要“应接尽接”,2021/1/27 10:00,人民健康网#观察评论
别犹豫，对新冠肺炎疫苗要“应接尽接”,2021/1/28 8:27,健康
墨西哥开始接种中国科兴新冠疫苗,2021/2/23 14:46,滚动新闻#全球抗疫进行时#国际#美洲
美国动物园猩猩接种试验性新冠疫苗,2021/3/8 8:33,滚动新闻#国际#美洲
斯里兰卡批准中国国药新冠疫苗紧急使用,2021/3/21 7:50,国际#周恬#湖北频道#新闻中心#环球
变异新冠病毒对儿童有哪些影响?,2021/2/1 11:25,人民健康网#健康舆情
白俄罗斯开始接种中国援助的新冠疫苗,2021/3/17 8:22,河南频道
新冠疫苗当打则打别被这些谣言误导,2021/2/4 8:42,人民健康网
印尼新冠疫情暴发以来第六次降息,2021/2/19 8:26,南亚东南亚视窗
菲律宾新增新冠确诊病例2886例,2021/3/11 8:19,南亚东南亚视窗
中国援助的新冠疫苗运抵津巴布韦,2021/2/16 8:18,综合报道
新冠疫苗做好大规模生产准备,2020/12/18 10:07,人民健康网#健康舆情
印尼启动新冠疫苗接种第二阶段,2021/2/18 8:34,南亚东南亚视窗
巴西：中国疫苗能够有效对抗变异新冠病毒,2021/3/11 14:30,滚动新闻#关注中国#全球抗疫进行时#国际
土耳其接种新冠疫苗超1012万剂次,2021/3/9 8:44,滚动新闻#欧洲#国际
首批中国新冠疫苗运抵匈牙利,2021/2/17 6:44,国际#滚动新闻#独家稿库#全球抗疫进行时#于洋
中国援助的新冠疫苗运抵津巴布韦,2021/2/16 7:59,滚动新闻#行业热点#健康・生活
爱尔兰宣布分阶段放松新冠防疫措施,2021/3/31 14:11,欧洲#滚动新闻#全球抗疫进行时#国际
白俄罗斯开始接种中国援助的新冠疫苗,2021/3/16 8:22,滚动新闻#欧洲#国际
玉溪红塔新冠疫苗接种全面铺开,2021/4/2 9:57,玉溪红塔#朱红霞#州市
法国劳工部长确诊感染新冠病毒,2021/3/15 8:59,国际#滚动新闻#欧洲#全球抗疫进行时
加沙地区发现变异新冠病毒感染病例,2021/3/30 9:56,国际#滚动新闻#独家稿库#新闻快递
新冠疫苗怎么打？记者直击接种全过程,2021/1/10 13:20,体育卫生
保障新冠病毒疫苗生产供应,2021/1/6 7:27,社会民生#民生万象#新闻中心#湖北频道#张隽
第二批中国新冠疫苗运抵智利,2021/2/2 8:06,国际新闻#浙江频道
布加勒斯特百岁老人完成新冠疫苗接种,2021/3/29 8:20,国际#滚动新闻
保障新冠病毒疫苗生产供应,2021/1/6 11:15,要闻#产经#吉林频道#时政#民生
研究发现：人体对新冠病毒免疫反应因性别而不同,2021/3/8 8:12,北京频道#健康
东城上线新冠疫苗接种“小程序”,2021/3/10 7:41,滚动新闻#东城区#十六区动态#北京频道
中国新冠疫苗助力多国抗疫,2021/1/23 8:28,周恬#国际#环球#新闻中心#湖北频道
孟加拉国日增新冠确诊病例创新高,2021/4/2 8:16,南亚东南亚视窗
英国首相接种阿斯利康新冠疫苗,2021/3/20 9:29,国际#滚动新闻#欧洲
全球多方呼吁推进公平获得新冠疫苗,2021/2/28 9:01,滚动新闻#健康・生活
美国动物园猩猩接种试验性新冠疫苗,2021/3/8 8:41,美国频道
有肺部疾病的人更易感染新冠？,2020/11/10 7:47,四川频道#卫生#即时新闻
美国动物园猩猩接种试验性新冠疫苗,2021/3/7 9:11,国际#美洲#滚动新闻
巴基斯坦启动新冠疫苗接种,2021/2/3 8:18,南亚东南亚视窗
厄瓜多尔签约购买中国科兴公司新冠疫苗,2021/2/26 8:36,滚动新闻#全球抗疫进行时#国际#美洲
新冠疫苗接种技术指南为公众解疑释惑,2021/3/31 8:51,经济・科技
中国新冠疫苗助力多国抗疫,2021/1/23 5:26,全球抗疫进行时#滚动新闻#国际
新冠疫苗第二剂接种明天启动,2021/1/21 15:07,滚动新闻#北京频道#社会民生
美药管局批准紧急使用强生新冠疫苗,2021/2/28 15:28,国际#美洲#滚动新闻
新冠病毒研究的最美“中国合声”,2021/2/8 8:21,健康・生活#观察评论
美药管局批准紧急使用强生新冠疫苗,2021/3/1 9:35,美国频道
武汉向全体市民发布新冠疫苗接种倡议书,2021/3/28 9:15,滚动新闻#健康・生活#原创稿件
新冠病毒灭活疫苗接种48小时后可献血,2021/3/28 0:05,健康・生活
新冠疫苗 五路齐发 中国在前列（大健康观察・新冠疫苗来了②）,2021/1/19 9:47,四川频道#卫生
首批中国康希诺新冠疫苗运抵巴基斯坦,2021/3/31 9:16,国内・国际#江苏频道
菲律宾新冠累计确诊超63.1万例,2021/3/18 8:40,南亚东南亚视窗
新冠病毒“极不可能”通过实验室引入人群,2021/2/10 8:59,健康・生活#行业热点#滚动新闻
综述：多国青睐中国新冠疫苗,2021/1/15 8:58,滚动新闻#全球抗疫进行时#国际#深度报道
厄瓜多尔在新冠疫情下筹备大选,2021/2/3 15:22,滚动新闻#国际#美洲
我国新冠疫苗安全性如何？怎么接种？,2020/12/22 9:43,贵州频道#采编人员信息统计#健康养生#郜林筱#频道稿件编辑统计查询
莫桑比克启动接种中国援助新冠疫苗,2021/3/8 23:46,国际
孟加拉国日增新冠确诊病例创新高,2021/4/2 8:19,国际#滚动新闻#亚太#全球抗疫进行时
美国新冠肺炎死亡病例超过五十万,2021/2/25 8:48,美国频道
澳大利亚批准使用首款新冠疫苗,2021/1/25 18:55,国际#滚动新闻#亚太
美国逾300万儿童感染新冠,2021/2/18 9:53,国际#美洲#滚动新闻#全球抗疫进行时
张伯礼等主编《新冠肺炎中西医诊疗》出版发行,2021/4/1 17:42,本网原创#滚动新闻#文旅・体育
