标题,发表时间,来源
美国纽约市确诊13例自英国发现的新冠变异毒株感染病例,2021/2/3 8:21,美国频道#滚动新闻#聚焦美国
抗击新冠肺炎疫情 我们在行动,2020/10/27 9:28,第三届中国优秀扶贫案例报告会
美国务卿蓬佩奥因接触新冠病毒感染者开始隔离,2020/12/17 8:44,国际
世卫组织调查总部人员新冠聚集性感染,2020/11/18 7:06,北京频道#社会民生#滚动新闻#健康
江西省人民医院有序推进新冠病毒疫苗接种,2021/1/8 7:05,江西要闻#社会#江西频道
中国加入“新冠肺炎疫苗实施计划”,2020/10/9 14:45,滚动新闻#健康#北京频道#国内资讯
镇宁自治县市场监督管理局开展新冠病毒检测试剂专项检查工作,2021/3/5 15:01,贵州频道#采编人员信息统计#镇宁新闻资讯#吴锋#地方网群#频道稿件编辑统计查询#镇宁视窗
英国专家：大多数欧洲国家或已存在变异新冠病毒,2020/12/24 10:42,采编人员信息统计#贵州频道#吴锋#国际要闻#频道稿件编辑统计查询
世卫组织：全球累计新冠确诊病例达116874912例,2021/3/10 9:02,上海频道#要闻#国际#美食| 健康#滚动新闻
全国累计报告接种新冠疫苗超一亿剂次（国务院联防联控机制发布会）,2021/3/29 5:41,健康・生活
新冠病毒在光滑表面可存活28天,2020/10/13 8:10,科技#医学健康
中国―世卫组织新冠病毒溯源研究联合专家组举行新闻发布会,2021/2/10 10:53,国际#关喜艳#湖北频道#新闻中心#环球
10月初以来俄单日新增确诊新冠病例首次低于1.1万,2021/3/2 18:34,俄罗斯频道#社会#滚动#滚动新闻#独家稿库#国际#人民网俄罗斯分公司报道集#消息
中国―世卫组织新冠病毒溯源研究联合专家组举行新闻发布会,2021/2/10 9:11,要闻#吉林频道
中国―世卫组织新冠病毒溯源研究联合专家组举行新闻发布会,2021/2/10 9:00,综合报道
中国―世卫组织新冠病毒溯源研究联合专家组举行新闻发布会,2021/2/10 8:31,国内国际#江西频道
孟加拉国累计新冠确诊病例超50万,2020/12/21 8:22,南亚东南亚视窗
日本政府：若接种新冠疫苗死亡，家属将获赔270万元,2021/2/22 8:25,滚动新闻#社会#日本频道
英国官员：全球有约4000种变异新冠病毒 疫苗仍有效,2021/2/6 17:44,英国频道
世卫组织专家：正密切关注任何新冠病毒来源相关研究,2021/2/6 16:13,国际
大热天里，新冠病毒怎么防？,2020/7/3 16:23,健康舆情#人民健康网#人民健康融媒体联盟#人民日报
美国超100万儿童感染新冠病毒,2020/11/18 8:35,美洲#国际#滚动新闻#全球抗疫进行时
北京22日启动重点人群新冠疫苗第二剂接种,2021/1/21 13:36,社会
全球累计新冠确诊病例达88383771例,2021/1/11 14:38,健康
世卫组织：全球累计新冠确诊病例达115289961例,2021/3/6 9:43,国内・国际#江苏频道
世卫组织：全球累计新冠确诊病例达115289961例,2021/3/6 9:18,上海频道
美国新冠肺炎确诊超2824万 死亡约50.2万,2021/2/24 8:21,美洲#国际#独家稿库#全球抗疫进行时#滚动新闻#张梦旭
世卫组织：全球累计新冠确诊病例达115289961例,2021/3/6 8:50,江西频道#国内国际
英国官员：全球有约4000种变异新冠病毒 疫苗仍有效,2021/2/6 9:12,国际#滚动新闻#欧洲
香港教资会增拨1亿港元资助新冠肺炎等传染病研究,2021/1/19 9:35,港澳新闻滚动#科教文卫#港澳
瑞典王子菲利普夫妇确诊感染新冠病毒,2020/11/27 9:21,健康舆情#人民健康网
蒙古国延长首都地区全民警戒状态以应对新冠疫情,2021/1/5 8:48,滚动新闻#全球抗疫进行时#国际
全球累计新冠确诊病例达89707115例,2021/1/13 10:13,健康
香港特区行政长官林郑月娥等率先接种科兴新冠疫苗,2021/2/23 8:30,国内国际#江西频道
满洲里市首例本土新冠肺炎确诊病例治愈出院,2020/12/8 8:36,人民健康网#地方报道
宜兴：新冠病毒核酸检测价格再下调,2021/2/3 14:16,宜兴#宜兴要闻
世卫组织：全球累计新冠确诊病例达106125682例,2021/2/10 9:15,要闻#上海频道#国际#滚动新闻#美食| 健康
世卫组织：全球累计新冠确诊病例达106125682例,2021/2/10 7:21,江西频道#国内国际
美11岁女孩返家时发现确诊新冠肺炎在家隔离的父母已去世,2021/3/1 9:58,美国频道
“新冠疫情下的肝炎诊疗现状调查”在京启动,2020/12/8 14:57,人民健康网
世卫组织：全球累计新冠确诊病例达116135492例,2021/3/8 4:38,国际
新冠检测超负荷致德国收紧测试标准,2020/11/11 9:53,浙江频道#网摘
塞拉利昂实施全国宵禁以应对新冠疫情,2021/1/26 10:06,国际#非洲#滚动新闻
纽约市长：若无及时补充，纽约市新冠疫苗将在两天后用尽,2021/1/20 9:54,美国频道
美国科罗拉多州发现疑似感染变种新冠病毒病例,2020/12/31 11:02,美国频道
俄罗斯累计确诊新冠感染病例超过273万,2020/12/16 20:28,国内・国际#江苏频道
海南疾控发布新冠疫苗紧急接种问题解答,2020/12/22 9:46,潘惠文#社会法治#编辑稿件统计#人民网海南频道#海南新闻#海南要闻
美国务卿因接触新冠病毒感染者开始隔离,2020/12/17 9:52,健康
新冠病毒刺突柔性结构发现,2020/8/22 18:11,国内国际#江西频道
新冠病毒刺突柔性结构发现,2020/8/22 17:19,人民健康网#医学前沿
香港特区行政长官林郑月娥等率先接种科兴新冠疫苗,2021/2/23 13:28,人民日报报系涉港澳报道集#港澳新闻滚动#时政新闻#港澳
世卫组织：全球累计新冠确诊病例达116874912例,2021/3/10 7:20,国内国际#江西频道
截至3月27日各地累计报告接种新冠病毒疫苗超过1亿剂次,2021/3/28 14:58,滚动新闻#政策声音#行业热点#原创稿件#健康・生活
世卫组织启动2021年新冠肺炎疫情“战略准备和应对方案”,2021/2/20 7:03,国内国际#江西频道
世卫组织：全球累计新冠确诊病例达116521281例,2021/3/9 4:44,国际
世卫组织：全球累计新冠确诊病例达114853685例,2021/3/5 3:00,国际
北京累计接种新冠疫苗1333.39万剂次 覆盖832.43万人,2021/3/25 21:24,社会・法治
与澳网相关的三名确诊病例被检测出感染变异新冠病毒,2021/1/25 9:08,体育
国际观察：中国新冠疫苗安全性获国际社会认可,2020/12/16 11:21,国际#深度报道#滚动新闻#独家稿库#国际观察#独家观察（原创）
部分重点人群接种新冠病毒疫苗,2020/12/20 0:00,统战要闻
中国援助老挝30万剂国产新冠疫苗运抵老挝万象,2021/2/8 14:26,国际#孙广勇#全球抗疫进行时#滚动新闻#独家稿库#亚太
吴尊友：核酸检测已成为新冠防控的“标配”,2020/11/25 17:13,防疫课堂#人民健康网#本网原创#原创稿件#国务院联防联控机制就冷链食品及秋冬季食品安全有关情况举行发布会
美国务卿蓬佩奥因接触新冠病毒感染者开始隔离,2020/12/17 8:27,国内・国际#江苏频道
蒙古国宣布将进入全国警戒状态以防控新冠疫情,2020/11/12 8:20,全球抗疫进行时#滚动新闻#亚太#国际
沈阳20万人份新冠疫苗到位 陆续开始接种,2021/1/4 16:59,要闻#原创列表
世卫组织：全球累计新冠确诊病例达115653459例,2021/3/7 2:35,国际
疾控专家：新冠疫苗接种非常有必要 接种后要继续戴口罩,2020/12/21 21:38,人民健康网#原创稿件
俄罗斯累计确诊新冠感染病例超过268万,2020/12/14 16:36,人民网俄罗斯分公司报道集#消息#国际#滚动新闻#社会#独家稿库#俄罗斯频道#滚动
塞内加尔从中国进口的第一批新冠疫苗抵达首都达喀尔,2021/2/18 16:06,高清#滚动图片新闻#国际图片#图片频道
石家庄市第四场新冠肺炎疫情防控发布会实录,2021/1/8 20:40,河北坚决打赢疫情防控阻击战#各地新政#河北频道#石家庄#本网专稿#滚动新闻#健康#河北疫情防控#频道原创新闻#防控疫情，各地在行动#地方要闻#河北
清镇市完成首批394名重点人群新冠疫苗接种工作,2021/1/13 14:50,贵州频道#采编人员信息统计#吴锋#战略合作#贵州省工业和信息化厅#新闻动态#频道稿件编辑统计查询
安徽确诊一例上海关联新冠肺炎病例,2020/11/10 18:17,社会
白俄罗斯新增新冠确诊病例1701例,2020/12/4 8:46,国际
广州南沙发现一例新冠肺炎无症状感染者,2020/12/21 11:10,本地#地市#广州#滚动#广东频道#健康
【#俄罗斯将开始大规模接种新冠疫苗#】据...,2020/12/3 11:25,
上海新增2例本地新冠肺炎确诊病例,2020/11/21 8:51,人民健康网
联合国报告：新冠肺炎疫情致全球1.2亿人陷入极端贫困,2021/3/26 8:46,经济・科技
俄罗斯累计确诊新冠感染病例超过268万,2020/12/14 18:01,江苏频道#国内・国际
世卫组织：全球累计新冠确诊病例达115653459例,2021/3/7 9:26,国内・国际#江苏频道
世卫组织：全球累计新冠确诊病例达114428211例,2021/3/4 6:41,国际
【疫情下的韩国】企业加紧生产新冠肺炎疫苗注射器,2021/2/4 8:50,韩国频道#社会#专题#图片#社会#原创新闻#抗击新冠肺炎疫情#地方/企业#滚动#企业
日本政府计划扩大接种新冠疫苗的医护人员规模至470万人,2021/2/19 16:13,中日万象
英国将在利物浦试点全城新冠病毒检测,2020/11/4 15:30,国际要闻
疾控专家：新冠疫苗接种非常有必要 接种后要继续戴口罩,2020/12/22 8:58,健康
青海降低新冠肺炎核酸检测最高限价,2021/1/30 7:53,人民健康网
新冠疫苗Ⅲ期临床试验为何至关重要,2020/10/20 8:10,人民健康网#医学前沿
韩国日增新冠确诊病例数创新高,2020/12/26 10:11,国际要闻
青岛市本地新冠肺炎确诊病例全部清零,2020/11/12 9:37,要闻#山东频道#滚动新闻
世卫组织：全球累计新冠确诊病例达115653459例,2021/3/7 8:35,国内国际#江西频道
中方会以公平合理价格向世界提供新冠疫苗,2021/2/5 9:10,中国外交#全球抗疫进行时#滚动新闻#国际
【#新冠康复患者重返雷神山泪流满面#[心...,2021/3/15 10:40,
综合消息：中东地区多国日增新冠病例过千,2020/12/4 9:31,国际#滚动新闻#中东#全球抗疫进行时
王毅出席联合国安理会新冠疫苗问题部长级公开会,2021/2/18 6:28,国际
美国新冠肺炎病例数或被大大低估,2020/9/15 17:15,美国频道
关于新冠核酸检测项目 四川这些市州下调了价格,2021/1/28 17:31,新闻资讯#四川频道
美国务卿因接触新冠病毒感染者开始隔离,2020/12/17 13:52,国际・军事
泰州泰兴通报一境外输入新冠肺炎无症状感染者复阳,2021/2/5 11:37,江苏频道#泰兴#泰州#社会
江苏这五类重点人群已开始接种新冠病毒疫苗,2020/12/28 11:35,江苏频道#江苏要闻#民生
阿联酋给予中国国药集团新冠疫苗正式注册,2020/12/10 5:50,国际
【直播：#上海新冠疫情防控新闻发布会#】...,2021/1/22 15:00,
波黑主席团轮值主席多迪克接受新冠治疗后出院,2021/1/6 9:02,滚动新闻#欧洲#全球抗疫进行时#国际
美疾控中心呼吁民众假期居家以防新冠传播,2020/12/25 10:02,美国频道
新冠病毒再次“席卷”世界足坛,2020/9/2 16:34,国际足球#滚动#体育
纸基电化学传感器：5分钟内测出新冠病毒,2020/12/10 9:34,四川频道#科技
世卫组织：全球累计新冠确诊病例达114140104例,2021/3/3 7:49,国内・国际#江苏频道
新冠疫苗Ⅲ期临床试验为何至关重要,2020/10/20 9:12,即时新闻#四川频道#卫生
北京：顺义仁和镇启动全员新冠疫苗接种,2021/2/9 8:22,社会・法治#社会万象
美媒：美国新冠疫苗采购策略或致储备过剩 招致各方批评,2021/3/15 10:56,国际
我国重组蛋白新冠病毒疫苗I期、II期临床试验结果发布,2021/3/26 11:47,国内・国际#江苏频道
福建省新冠肺炎疫情防控工作部署会议召开,2021/1/19 7:59,福建频道#时政#转载#新闻列表#要闻#吴舟#行动！防控！福建全力抗击新型冠状病毒肺炎疫情
世卫组织：全球累计新冠确诊病例达115289961例,2021/3/6 3:36,国际
【直播：#国务院介绍新冠病毒疫苗有关情况...,2020/12/31 10:00,
全球累计新冠确诊病例达84474195例,2021/1/6 9:58,健康
世卫组织：全球累计新冠确诊病例达115289961例,2021/3/6 9:12,健康・生活#滚动新闻
研究发现新冠肺炎 感染几率由接触方式决定,2020/12/7 6:34,人民健康网#医学前沿
香港特区政府完成佐敦“受限区域”强制性新冠病毒检测,2021/1/25 16:59,港澳新闻滚动#港澳#科教文卫
西班牙政府宣布对新冠疫苗和检测试剂免征增值税,2020/12/10 8:48,国际
十四运会西安重大配套项目施工人员接种新冠疫苗,2021/1/20 7:49,陕西#滚动新闻#陕西频道#西安
美国新冠肺炎确诊2999万例 福奇说美国疫情尚未转危为安,2021/3/25 8:29,国际#美洲#独家稿库#滚动新闻#全球抗疫进行时#李志伟
罗马尼亚网球名将哈勒普接种新冠疫苗,2021/2/25 10:19,体育
世卫组织启动2021年新冠肺炎疫情“战略准备和应对方案”,2021/2/21 8:51,上海频道
工信部：国内已有18家企业开展新冠疫苗产能建设,2020/12/31 13:40,公司#产经#本网原创#产业
新冠检测超负荷致德国收紧测试标准,2020/11/11 9:54,人民健康网
全覆盖新冠肺炎药品 新版医保药品目录今起落地,2021/3/1 15:45,健康・生活
世卫组织：欧洲地区新冠疫情依然严峻,2020/11/20 16:38,欧洲#全球抗疫进行时#滚动新闻#国际
新冠疫苗问世还有多远,2020/7/22 16:53,医学健康#科技
世卫组织：全球累计新冠确诊病例达101053721例,2021/1/30 7:54,人民健康网
新西兰首批新冠疫苗最快下周获批 边境或长时间关闭,2021/1/27 14:10,时政|经济#澳新频道#滚动
美国球员、高尔夫世界第一约翰逊感染新冠,2020/10/15 9:55,体育
安徽部署两节期间新冠肺炎疫情防控工作,2020/12/28 7:29,省内要闻#安徽新闻列表
国家卫健委：截至3月14日共接种新冠病毒疫苗6498万人次,2021/3/15 15:02,健康・生活#原创稿件#行业热点#滚动新闻#政策声音
印尼单日新增新冠确诊病例首超8000,2020/12/4 8:45,健康舆情#人民健康网
埃及对感染新冠病毒隐情不报者进行严惩,2020/10/26 10:12,独家稿库#非洲#全球抗疫进行时#安国章专栏#新闻快递#滚动新闻#国际
世卫组织：全球累计新冠确诊病例达114853685例,2021/3/5 10:47,上海频道#国际#滚动新闻#美食| 健康
世卫组织：全球累计新冠确诊病例达114428211例,2021/3/4 8:25,国内国际#社会#江西频道
媒体报超150名“支援”华盛顿的国民警卫队员感染新冠,2021/1/24 9:35,国际#云南频道
俄罗斯新增新冠确诊病例16202例,2020/10/29 9:19,国际
世卫组织：全球累计新冠确诊病例达114853685例,2021/3/5 7:52,国内国际#社会#江西频道
新AI工具“听”咳嗽声鉴别新冠肺炎,2020/11/5 8:18,5G#资讯
湖北多地启动新冠疫苗紧急接种（附接种须知）,2021/1/2 12:41,新闻中心#湖北频道#社会民生#民生万象#周恬
世卫组织：全球累计新冠确诊病例达114853685例,2021/3/5 7:09,国际
俄罗斯单日出院的新冠患者首次超过2.5万名,2020/11/18 20:11,滚动新闻#独家稿库#俄罗斯频道#滚动#社会#国际#消息#人民网俄罗斯分公司报道集
坚持生命至上 辽宁全力救治每一名新冠肺炎患者,2020/12/28 7:37,要闻
非洲慢性病人患新冠肺炎风险更高,2020/9/29 8:42,浙江频道#网摘
新冠疫苗短缺　欧洲多国已经或考虑延长两剂接种间隔,2021/1/6 8:35,国际#全球抗疫进行时#滚动新闻#欧洲
日本东京都新冠阳性率下降 病床仍严重短缺,2021/1/27 16:42,中日万象
美国新冠肺炎确诊2768万例 过去两周死亡约4.25万例,2021/2/16 9:10,滚动新闻#独家稿库#李志伟#国际#美洲
斯洛文尼亚单日新冠死亡病例数创新高,2020/12/5 9:54,国际要闻
世卫组织：全球累计新冠确诊病例达114140104例,2021/3/3 6:24,滚动新闻#全球抗疫进行时#国际
所罗门群岛出现首例新冠确诊病例,2020/10/7 8:06,南太岛国#澳新频道#滚动#社会|科技
望京街道“望京疫苗帮”助力新冠疫苗接种工作,2021/2/24 10:07,朝阳区#滚动新闻#北京频道#本网特稿#十六区动态
俄罗斯累计确诊新冠感染病例超过218万,2020/11/26 17:14,人民网俄罗斯分公司报道集#消息#国际#俄罗斯频道#滚动#社会#滚动新闻#独家稿库
日本政府进行有关协调 将召开咨询会研究新冠疫情,2021/2/8 16:44,中日万象
世卫组织启动2021年新冠肺炎疫情“战略准备和应对方案”,2021/2/20 8:58,国际#滚动新闻#美食| 健康#要闻#上海频道
【全国#重点人群接种新冠疫苗4052万剂...,2021/2/10 15:14,
法国累计新冠确诊病例超200万例,2020/11/18 8:53,人民健康网#健康舆情
世卫组织：全球累计新冠确诊病例达103362039例,2021/2/4 7:56,人民健康网
世卫组织新冠病毒溯源国际专家组将于14日来华,2021/1/11 13:33,国际
北京市银协发布新冠肺炎疫苗接种倡议书 建设金融服务业免疫屏障,2021/3/25 17:41,财经纵横#滚动新闻#北京频道#本网特稿
古巴预计年内生产1亿剂本土研发的新冠疫苗,2021/1/22 21:27,国际#滚动新闻
美国新冠肺炎确诊超3006万 拜登宣布疫苗接种新目标,2021/3/26 8:52,国际#美洲#滚动新闻#独家稿库#李志伟
世卫组织：全球累计新冠确诊病例达114428211例,2021/3/4 9:06,滚动新闻#美食| 健康#国际#要闻#上海频道
全球累计新冠确诊病例达83322449例,2021/1/4 14:18,健康
南非发现变异新冠病毒 为第二波疫情诱因,2020/12/21 21:37,滚动新闻#独家稿库#消息#国际
普京：俄罗斯国家发展议程不受新冠疫情影响,2020/12/23 20:47,滚动新闻#俄罗斯频道#滚动#独家稿库#国际#人民网俄罗斯分公司报道集#消息#时政
紧盯目标任务 强化责任落实 有序推进新冠病毒疫苗接种工作,2021/3/20 8:08,四川#四川频道
香港将扩大新冠疫苗优先接种群组 增加每日疫苗接种名额,2021/3/9 15:37,港澳#港澳生活#港澳新闻滚动
乌克兰总统泽连斯基住院治疗新冠肺炎,2020/11/12 15:46,国际#滚动新闻#独家稿库#谭武军
淮北市部署“两节”期间新冠肺炎疫情防控工作,2020/12/31 17:25,淮北#安徽新闻列表
法国再度全国“封城”遏制新冠疫情,2020/10/30 8:21,特别关注
世卫组织：全球累计新冠确诊病例达114428211例,2021/3/4 3:22,国际#滚动新闻#全球抗疫进行时
印度累计新冠确诊病例增至7494551例,2020/10/19 8:52,南亚东南亚视窗
山东各地迅速开展新冠疫苗接种 共筑全民免疫屏障共享健康生活,2021/3/30 9:18,山东频道#要闻#滚动新闻#社会法治
新加坡一孕妇感染新冠 新生男婴自带抗体,2020/11/30 8:22,南亚东南亚视窗
美国新冠肺炎确诊超2880万 死亡达51.9万,2021/3/5 8:12,国际#美洲#滚动新闻#李志伟#独家稿库#全球抗疫进行时
朝阳区做好大规模接种新冠疫苗准备 居民可通过“疫点通”预约,2021/2/17 21:54,朝阳区#地方要闻#滚动新闻#北京频道#应对新型冠状病毒肺炎疫情 北京在行动#本网原创
【#我国新冠疫苗接种量超2400万剂次#...,2021/1/31 16:11,
春节期间宁夏新冠肺炎疫情防控形势平稳,2021/2/19 10:23,宁夏要闻
英国将新冠密接者自我隔离期缩短至10天,2020/12/15 8:48,国际
阿联酋给予中国国药集团新冠疫苗正式注册,2020/12/10 9:13,国际#滚动新闻#美食| 健康#上海频道#要闻
开进工地、开进社区:丰台率先启用移动新冠疫苗接种车,2021/3/30 7:45,十六区动态#北京频道#滚动新闻#丰台区
研究发现新冠肺炎 感染几率由接触方式决定,2020/12/7 8:37,健康
湖南有序开展重点人群新冠疫苗接种工作,2021/1/8 20:58,滚动新闻#本网专稿
世卫组织：全球累计新冠确诊病例达114140104例,2021/3/3 8:20,江西频道#国内国际#社会
浙江有序推进重点人群新冠病毒疫苗紧急接种,2020/12/30 8:47,浙江频道#今日热点
巴西计划购买1亿剂中企新冠疫苗,2021/1/9 9:29,国际#美洲#滚动新闻
新冠疫苗Ⅲ期临床试验为何至关重要,2020/10/20 8:18,医学健康#科技
巴西一州在2019年12月采集的血样中发现新冠病毒抗体,2021/1/14 8:54,国际#美洲#滚动新闻#全球抗疫进行时
直击成都新冠疫苗接种点：只有0.5ml，一两秒就结束了,2021/3/3 7:43,成都#四川频道#即时新闻
我国科学家首次揭示新冠肺炎患者蛋白质分子病理全景图,2021/1/12 8:52,大学#滚动新闻
逾300名香港市民率先接种国产新冠疫苗,2021/2/24 13:52,港澳#科教文卫#香港生活#港澳新闻滚动
【科兴中维#新冠灭活疫苗克尔来福获批上市...,2021/2/6 18:00,
【#全球新冠疫苗接种剂数已超确诊病例数#...,2021/2/5 9:30,
约翰斯・霍普金斯大学：美国累计新冠死亡病例超过50万例,2021/2/23 7:04,国际
我国重组蛋白新冠病毒疫苗I期、II期临床试验结果发布,2021/3/26 9:56,健康・生活
日本首次发现南非报告的变异新冠病毒感染病例,2020/12/30 8:33,人民健康网
美预测新冠病毒传播高风险场所,2020/11/12 8:23,医学健康#科技
美国新冠肺炎确诊超2888万 死亡达52.2万,2021/3/6 16:27,国际#美洲#滚动新闻#独家稿库#全球抗疫进行时#李志伟
【#印度阅兵彩排150多名士兵感染新冠#...,2020/12/27 17:30,
伊拉克累计新冠确诊病例超过55万例,2020/11/30 8:07,全球抗疫进行时#滚动新闻#亚太#国际
菅义伟：日本力争从2月底开始实施新冠疫苗接种,2021/1/4 16:44,中日万象
新AI工具“听”咳嗽声鉴别新冠肺炎,2020/11/5 8:35,科技
日本单日新增新冠确诊病例数再创纪录,2020/11/20 8:41,人民健康网#健康舆情
日本单日新增新冠确诊病例数再创纪录,2020/11/20 8:24,日本频道#社会#滚动新闻
加拿大累计新冠确诊病例超过35万例,2020/11/27 9:37,国际
俄罗斯累计确诊新冠感染病例超过248万,2020/12/7 17:50,俄罗斯频道#滚动#社会#滚动新闻#独家稿库#国际#消息#人民网俄罗斯分公司报道集
南明区开展新冠肺炎疫情防控全员核酸检测应急演练,2021/1/20 11:17,采编人员信息统计#贵州频道#聚焦南明#郜林筱#南明区视窗#频道稿件编辑统计查询#地方网群
疾控专家：接种新冠病毒疫苗后仍应戴口罩,2021/1/9 18:25,江西频道#本网专稿#社会#江西要闻
日本女子感染新冠在家中自杀 称抱歉给他人添了麻烦,2021/1/23 9:30,日本频道#社会
俄罗斯累计确诊新冠感染病例超过256万,2020/12/11 19:52,滚动新闻#社会#独家稿库#俄罗斯频道#滚动#国际#人民网俄罗斯分公司报道集#消息
欧洲新冠疫情有所反弹 美国新冠肺炎确诊241万,2020/6/26 18:45,国际#燕勐#其他#滚动新闻#独家稿库#每日全球疫情要览
莫斯科从5日起为高风险人群接种新冠病毒疫苗,2020/12/4 9:25,频道稿件编辑统计查询#国际要闻#贵州频道#采编人员信息统计#吴锋
北京因私出境人员可经社区审核后接种新冠疫苗,2021/1/4 8:15,人民健康网#地方报道
德国：感染新冠病毒或影响胰腺功能,2020/9/7 16:42,人民健康网
南非将在3月底前完成百万人口新冠肺炎疫苗接种,2021/2/26 8:27,独家稿库#消息#滚动新闻#非洲#全球抗疫进行时#国际
山东已有237.8万人接种新冠病毒疫苗 接种总量全国第三,2021/3/20 9:02,山东频道#要闻#滚动新闻
世卫组织：全球累计新冠确诊病例达113076707例,2021/2/28 9:26,滚动新闻#健康・生活
罗马尼亚累计新冠死亡病例破万例,2020/11/23 9:00,国际要闻
多国将联手生产新冠疫苗,2020/8/14 17:08,国际观察#滚动新闻#全球抗疫进行时#国际
缅甸累计新冠确诊病例数超10万,2020/12/8 8:46,南亚东南亚视窗
积极开展新冠疫苗对外援助为构建人类卫生健康共同体作出新贡献,2021/3/20 8:58,滚动新闻#军事
新生儿可否接种新冠疫苗？专家：基于临床数据不断完善接种策略,2021/3/29 9:43,河南频道
首都高校52万师生员工已接种新冠疫苗,2021/3/29 8:56,滚动新闻#行业热点#健康・生活
比利时单日新增新冠病例超万例,2020/10/17 8:51,国际要闻
尼泊尔累计新冠病例数已超20万,2020/11/12 8:37,南亚东南亚视窗
世卫组织：全球累计新冠确诊病例达112209815例,2021/2/26 5:26,国际
英国新冠确诊病例破60万,2020/10/13 9:04,国际要闻
新冠疫苗接受度首次全球调查结果发布,2020/10/22 8:41,人民健康网
新AI工具“听”咳嗽声鉴别新冠肺炎,2020/11/5 10:56,频道稿件编辑统计查询#贵州频道#采编人员信息统计#IT科技#吴锋
莫斯科格林伍德国际贸易中心组织新冠疫苗免费接种活动,2021/2/6 11:13,国际#滚动新闻#独家稿库#张光政
佐科视察新冠疫苗接种模拟并发表相关声明,2020/11/19 15:34,人民网驻印尼记者报道集#国际#亚太#滚动新闻#独家稿库#全球抗疫进行时
世卫组织：全球累计新冠确诊病例达113076707例,2021/2/28 8:43,国内・国际#江苏频道#滚动
西城区新冠疫苗累计接种超百万剂 全员接种单位可优先评优,2021/3/29 7:33,十六区动态#北京频道#西城区#滚动新闻#健康
世卫组织：全球累计新冠确诊病例达113076707例,2021/2/28 5:30,国际
美FDA发布强生研发的疫苗分析报告：能预防中度至重度新冠感染,2021/2/25 9:11,美国频道
