标题,发表时间,来源
专家：不要过度渲染新冠治愈患者“复阳”,2020/8/17 16:21,国内
世卫组织：全球累计新冠确诊病例达76250431例,2020/12/23 8:30,人民健康网#健康舆情
印尼新增新冠确诊病例14224例 延长外籍旅客入境禁令,2021/1/17 13:21,国际#滚动新闻#独家稿库#亚太#张杰#全球抗疫进行时
世卫组织：全球累计新冠确诊病例达76250431例,2020/12/23 7:45,国际新闻#安徽新闻列表
加沙出现首例社区传播新冠死亡病例,2020/8/28 17:23,滚动新闻#中东#国际
非洲新冠病毒基因组测序实验室网络启动,2020/9/16 16:25,国际#关喜艳#新闻中心#湖北频道#环球
韩国宣布计划明年研发出国产新冠疫苗,2020/9/15 16:26,国际#滚动新闻#亚太#全球抗疫进行时
新冠病毒在日本变异是否应该担心？,2020/8/13 16:36,科技#医学健康
武汉市抗击新冠肺炎疫情先进事迹首场报告会举行,2020/10/9 22:51,本网原创#湖北新闻#张颖#新闻中心#实况武汉#湖北频道#热点专题
包头一批进口冷冻猪前肘 新冠病毒核酸检测呈阳性,2021/1/22 8:44,人民健康网#食品
【#南京拦截一批新冠阳性进口冷链食品#】...,2020/11/11 18:45,
蒙古国新冠肺炎疫情形势严峻 拟将疫情防控高度戒备状态延长至4月30日,2021/3/26 11:45,国际#霍文#独家稿库#滚动新闻#亚太
世卫组织：全球累计新冠确诊病例达74299042例,2020/12/20 9:41,国际要闻
【#辽宁新增5例本土确诊#】#新冠肺炎最...,2020/12/30 7:59,
世卫组织：全球累计新冠确诊病例达74299042例,2020/12/20 9:12,国际
俄罗斯累计确诊新冠感染病例超过181万,2020/11/10 16:52,人民网俄罗斯分公司报道集#消息#深度报道#国际#俄罗斯频道#滚动#社会#独家稿库
福建省新冠肺炎疫情防控工作部署会议召开 尹力讲话,2021/1/19 15:01,领导活动
全国抗击新冠肺炎疫情表彰大会即将举行,2020/9/8 19:08,高清图库#江西频道
从新冠疫苗研发看应急科研管理：如何做到“召之即战”,2020/10/27 8:13,医学健康#科技
日本单日新增新冠确诊病例首次超2500例,2020/11/23 8:20,日本频道#社会#滚动新闻
世卫组织：全球累计新冠确诊病例达75110651例,2020/12/21 8:27,国际
世卫组织：全球累计新冠确诊病例达75110651例,2020/12/21 5:52,国际
俄第二种新冠疫苗将于12月10日前投入民用,2020/11/19 8:15,国际
吉林省发布新冠肺炎中医药防治方案 要求确诊病例治疗优先使用清肺排毒汤,2021/1/25 15:16,健康#吉林频道#民生#社会
美国又一联邦参议员新冠病毒检测结果呈阳性,2020/8/21 16:25,国际
广西疾控中心发布冬春季节新冠疫情防控建议,2021/1/1 9:51,广西要闻
美国新冠病毒感染病例数超过647万,2020/9/14 3:34,上海频道#滚动新闻#社会| 法治
阿拉善盟新冠肺炎防控工作指挥部19号公告,2021/1/1 17:48,最新消息
世卫组织：全球累计新冠确诊病例达75704857例,2020/12/22 7:57,国内国际#江西频道
全球累计新冠确诊病例达42512186例,2020/10/26 9:49,健康
印尼已有百名医生因感染新冠病毒去世,2020/9/1 17:14,国际要闻
美国新冠肺炎患者出院后收到巨额账单,2020/8/24 18:35,美国频道
世卫组织：全球累计新冠确诊病例达72196732例,2020/12/17 8:43,国际
世卫组织：全球累计新冠确诊病例达72196732例,2020/12/17 8:29,浙江频道#国际新闻
世卫组织：全球累计新冠确诊病例达58900547例,2020/11/25 9:59,湖北频道#环球#新闻中心#科教文体#健康#国际#周恬
英国进一步提升新冠疫情防控力度,2020/9/23 15:07,国际・军事
科普：多国新冠疫情反弹 “第二波”疫情到来？,2020/10/15 9:32,国际要闻
俄第二种新冠疫苗将于12月10日前投入民用,2020/11/19 8:58,国际要闻#频道稿件编辑统计查询#贵州频道#采编人员信息统计#吴锋
科茨：不管有没有新冠病毒东京奥运会都将举行,2020/9/8 16:31,滚动#综合#体育#2020年东京奥运会
韩计划2月底开启重点人群新冠疫苗接种,2021/1/5 9:39,韩国频道#国际#社会#专题#滚动#滚动新闻#独家稿库#原创新闻#抗击新冠肺炎疫情
世卫组织：全球累计新冠确诊病例达75110651例,2020/12/21 8:50,人民健康网#健康舆情
世卫组织：全球累计新冠确诊病例达58900547例,2020/11/25 7:11,江西频道#国内国际
尼泊尔文化、旅游与民航部长感染新冠病毒,2020/10/11 8:53,南亚东南亚视窗
世卫组织：184个国家和地区加入新冠肺炎疫苗计划,2020/10/20 8:04,国内・国际#江苏频道
世卫组织：欧洲新冠死亡率将上升 情况“更艰难”,2020/9/15 16:58,人民健康网
不含邮轮病例的日本新冠累计确诊数超9万,2020/10/14 13:29,日本频道#社会#新闻一览#滚动新闻
研究认为他汀类药物可降低新冠死亡率,2020/6/29 22:10,其他#国际#滚动新闻
大连港一冷链企业4名工作人员新冠病毒检测呈阳性,2020/12/16 1:05,原创列表
科技部：新冠病毒变异不大 未对疫苗研发造成影响,2020/10/20 16:42,科技
2021年2月8日湖北省新增新冠肺炎确诊病例0例,2021/2/9 9:39,新闻中心#湖北频道#湖北各地#民生万象#周恬#湖北要闻#社会民生
约翰斯・霍普金斯大学：美国累计新冠确诊病例超2500万例,2021/1/25 1:55,国际
1月17日湖北新增新冠肺炎确诊病例0例,2021/1/18 9:37,湖北新闻#最新播报#重点推荐#最新播报#实况武汉#关喜艳#新闻中心#实况武汉#聚焦新型冠状病毒性肺炎#湖北频道#热点专题
【#新冠检测阳性冷冻猪肉流入合肥# 当地...,2020/12/12 8:30,
新冠肺炎疫情让科研与教育成关注焦点,2020/9/8 17:06,频道稿件编辑统计查询#教育在线#顾兰云#采编人员信息统计#健康养生#贵州频道#教育在线
普拉尼斯新冠肺炎检测呈阳性 退出泰国羽毛球公开赛,2021/1/20 9:26,赵欣悦#体育#综合#滚动#本网原创#羽毛球
美国又一联邦参议员新冠病毒检测结果呈阳性,2020/8/21 21:34,美国频道
印度新冠肺炎患者收治酒店发生火灾,2020/8/10 15:42,湖北频道#环球#新闻中心#国际
欧盟委员会主席称欧盟新冠疫苗接种有望12月底前启动,2020/11/26 9:53,贵州频道#采编人员信息统计#吴锋#国际要闻#频道稿件编辑统计查询
世卫组织：全球累计新冠确诊病例达74299042例,2020/12/20 6:43,国际
美国新冠病毒感染病例超过643万,2020/9/12 16:17,滚动新闻#独家稿库#美洲#郑琪#国际
俄罗斯累计确诊新冠感染病例超过116万,2020/9/29 16:43,人民网俄罗斯分公司报道集#国际#消息#滚动新闻#独家稿库#俄罗斯频道#滚动#社会
美国又一联邦参议员新冠病毒检测结果呈阳性,2020/8/21 16:53,滚动新闻#全球抗疫进行时#国际#美洲
新西兰现6例变异新冠病毒感染者 疫情App使用量下滑,2021/1/6 13:13,滚动#澳新频道#社会|科技
【独家】多名中国权威流行病学专家呼吁：世卫应赴多国开展新冠病毒溯源研究,2021/2/5 0:58,国际#滚动新闻#全球抗疫进行时
科普：多国新冠疫情反弹 “第二波”疫情到来？,2020/10/15 16:19,上海频道#滚动新闻#美食| 健康
世卫组织：全球累计新冠确诊病例达57882183例,2020/11/23 7:53,人民健康网
世卫组织：全球累计新冠确诊病例达75704857例,2020/12/22 9:14,人民健康网#健康舆情
世卫组织：全球累计新冠确诊病例达75704857例,2020/12/22 9:09,滚动新闻#国际#美食| 健康#要闻#上海频道
白宫医生：特朗普新冠病毒检测结果连续几日呈阴性,2020/10/13 14:38,美国频道
24日辽宁无新增新冠肺炎确诊病例,2020/11/25 10:43,人民健康网
美FDA发布德美研发的新冠疫苗分析报告：符合紧急使用授权标准,2020/12/9 9:20,聚焦美国#美国频道#滚动新闻
23日辽宁无新增新冠肺炎确诊病例,2020/11/24 10:40,人民健康网
科普：多国新冠疫情反弹 “第二波”疫情到来？,2020/10/15 9:08,人民健康网#健康舆情
日本累计新冠确诊病例超6万例,2020/8/21 17:23,高清图库#江西频道
美国新冠肺炎确诊病例超过2641万 死亡病例达44.6万,2021/2/3 15:51,国内国际#江西频道
【#巴塞罗那动物园4只狮子感染新冠# 现...,2020/12/9 9:15,
谭德塞接触新冠确诊者后隔离：感觉良好 无任何症状,2020/11/2 8:54,人民健康网
无锡20人感染新冠死亡？警方：造谣者被行拘7日,2021/1/23 12:21,无锡新闻#江苏频道#社会民生#社会
美国总统特朗普接受新冠病毒检测并将进行隔离,2020/10/2 12:13,国际
我国已累计开展新冠病毒疫苗接种九百多万剂次（国务院联防联控机制发布会）,2021/1/10 8:56,国内
香港特区政府：新冠肺炎疫苗使用有严格程序 市民不应轻信传言,2021/1/15 17:05,港澳#科教文卫#港澳新闻滚动
美国驻阿富汗大使馆出现新冠病例,2020/6/22 16:35,国际#美洲#滚动新闻
世卫组织：全球累计新冠确诊病例达58425681例,2020/11/24 3:14,滚动新闻#全球抗疫进行时#国际
新冠肺炎疫情应急处置演练在北海举行,2020/8/1 17:21,广西要闻
世卫组织：新冠肺炎疫情是百年一遇的健康危机,2020/8/1 16:31,滚动新闻#张朋辉#国际#其他
1月29日湖北新增新冠肺炎确诊病例0例,2021/1/30 9:48,最新播报#湖北新闻#关喜艳#实况武汉#最新播报#湖北频道#新闻中心#热点专题#实况武汉#聚焦新型冠状病毒性肺炎
全球新冠病例破4000万 疫情缘何加速上升,2020/10/22 11:08,权威发布#智斗新型冠状病毒肺炎
美国新冠肺炎确诊病例达1759万 死亡超过31.5万,2020/12/20 8:10,滚动新闻#全球抗疫进行时#独家稿库#张梦旭#国际#美洲
美疾控中心要求各州做好分发新冠疫苗准备,2020/9/3 22:35,国际・军事
美疾控中心要求各州做好分发新冠疫苗准备,2020/9/3 22:23,滚动新闻#全球抗疫进行时#国际#美洲
北京已启用220个新冠疫苗接种点 两天接种疫苗7万余剂,2021/1/4 8:34,北京频道#社会民生#滚动新闻#健康
【#辽宁新增3例本土确诊#】#新冠肺炎最...,2021/1/3 14:36,
韩国又现两例感染变异新冠病毒病例 一人死亡后确诊,2020/12/31 8:45,人民健康网
新冠病毒灭活疫苗领跑一步,2020/6/24 17:55,人民健康网
伊朗累计新冠确诊病例超过100万例,2020/12/4 9:31,健康
研发团队：新冠灭活疫苗研发生产能够实现快速、有效、足量,2020/9/17 21:25,国内・国际
意大利新冠疫情继续缓解,2020/5/21 16:40,国际#欧洲#滚动新闻
新冠疫苗III期临床试验何时结束？国家药监局回应,2020/10/20 17:06,人民健康网#国务院联防联控机制介绍新冠疫苗有关情况#原创稿件
24日辽宁无新增新冠肺炎确诊病例,2020/11/25 7:54,头条二
普京：俄罗斯第二支新冠疫苗将于9月问世,2020/8/28 17:29,国际#消息#滚动新闻#欧洲#全球抗疫进行时
世卫组织：全球累计新冠确诊病例达74299042例,2020/12/20 8:52,人民健康网#健康舆情
新冠肺炎无症状感染者的免疫反应可能较弱,2020/7/2 16:59,医学前沿#人民健康网#科普知识
世界头号羽毛球男单桃田贤斗确诊感染新冠病毒,2021/1/4 16:44,中日万象
石家庄市新冠肺炎疫情防控第33场新闻发布会实录,2021/2/6 20:08,河北频道#石家庄#抗疫情#社会#河北坚决打赢疫情防控阻击战#本网专稿#滚动新闻#促生产（复工复产）#河北疫情防控#地方要闻#频道原创新闻#防控疫情，各地在行动#河北
俄罗斯累计确诊新冠感染病例超过124万,2020/10/7 18:00,独家稿库#俄罗斯频道#社会#滚动新闻#滚动#消息#国际#人民网俄罗斯分公司报道集
约翰斯・霍普金斯大学：美国累计新冠确诊病例超2300万例,2021/1/14 9:12,人民健康网
马尔代夫累计新冠病例超7000例,2020/8/27 16:05,国际#滚动新闻#亚太#全球抗疫进行时
美实际感染新冠人数可能是报告的8倍,2020/11/30 10:04,美国频道
世卫组织：全球累计新冠确诊病例达75110651例,2020/12/21 8:43,人民健康网
世卫组织：全球累计新冠确诊病例达75110651例,2020/12/21 8:30,要闻#上海频道#国际#滚动新闻#美食| 健康
综合消息：拉美新冠病例超1500万 多国启动疫苗接种,2020/12/26 8:23,国际#美洲#滚动新闻#全球抗疫进行时
专家：新冠病毒灭活疫苗打两针次免疫效果会更好,2020/12/23 9:06,健康
中国科学家果断、负责应对新冠疫情,2020/8/6 16:20,国内国际#江西频道
巴勒斯坦卫生部长说巴实际新冠病例数可能是公布的3倍,2020/11/15 8:09,上海频道#滚动新闻#社会| 法治
世界头号羽毛球男单桃田贤斗确诊感染新冠病毒,2021/1/4 8:15,日本频道#社会#滚动新闻
2月28日新增新冠肺炎确诊病例19例,2021/3/1 14:03,健康
北京东城：九类重点人群新冠疫苗首针累计接种14.6万剂次,2021/2/1 16:30,北京疫情防控工作新闻发布会#北京频道#社会民生#应对新型冠状病毒肺炎疫情 北京在行动#疫情动态#本网原创
世卫组织：全球累计新冠确诊病例达74299042例,2020/12/20 8:10,江西频道#国内国际
专家：新冠病毒灭活疫苗打两针次免疫效果会更好,2020/12/21 21:34,人民健康网#原创稿件
综合消息：亚欧地区新冠疫情继续蔓延 俄罗斯新增病例数维持高位,2021/1/7 8:52,国际#滚动新闻#欧洲#全球抗疫进行时
俄罗斯累计确诊新冠感染病例超过122万,2020/10/5 17:01,独家稿库#俄罗斯频道#滚动#滚动新闻#社会#国际#人民网俄罗斯分公司报道集#消息
世界头号羽毛球男单桃田贤斗确诊感染新冠病毒,2021/1/4 9:44,滚动#羽毛球#综合#体育
21日辽宁无新增新冠肺炎确诊病例,2020/11/22 8:21,头条二
新疆喀什现有新冠肺炎确诊病例清零,2020/11/20 10:58,新疆频道#科教・社会#滚动新闻#新疆新闻#要闻#地州
印尼已有百名医生因感染新冠病毒去世,2020/9/1 17:08,国际#亚太#滚动新闻#全球抗疫进行时
为防止变异新冠病毒 日本出台限制运动员入境措施,2020/12/30 13:13,日本频道#社会#滚动新闻
美新疫情纾困法案将不再要求企业为感染新冠病毒员工提供带薪休假,2020/12/25 10:01,美国频道
俄财政部长：俄民众大规模接种新冠疫苗需要750至1000亿卢布,2020/12/30 21:46,滚动新闻#俄罗斯频道#独家稿库#滚动#国际#人民网俄罗斯分公司报道集#消息#时政
俄罗斯累计确诊新冠感染病例超过118万,2020/10/1 21:31,消息#国际#人民网俄罗斯分公司报道集#滚动新闻#社会#独家稿库#俄罗斯频道#滚动
美疾控中心研究发现 去年12月美国或已存在新冠病毒,2020/12/3 9:57,要闻#上海频道#滚动新闻#国际
湖北表彰1164名抗击新冠肺炎疫情先进个人,2020/9/22 18:04,国内要闻
世卫组织：全球累计新冠确诊病例达72851747例,2020/12/18 5:26,滚动新闻#全球抗疫进行时#国际
我国已累计开展新冠病毒疫苗接种九百多万剂次（国务院联防联控机制发布会）,2021/1/10 8:52,社会#吉林频道#时政#要闻
北青报：解决新冠疫苗费用应在医保外多出硬招,2020/10/12 8:03,每日最新评论#观点#社会・民生
美国新冠确诊病例超过573万,2020/8/25 16:20,滚动新闻#独家稿库#国际#美洲#郑琪
日本发布研究：新冠病毒变异后传染性更强 从欧洲开始扩散,2020/11/13 13:29,社会#日本频道#滚动新闻
不含邮轮病例的日本新冠累计确诊数超9万,2020/10/14 15:58,中日万象
内蒙古自治区新冠肺炎疫情防控指挥部召开电视电话会议,2021/1/10 8:31,要闻#防控疫情，各地在行动#内蒙古频道#各地在行动系列报道
世卫组织：全球累计新冠确诊病例达72196732例,2020/12/17 7:14,江西频道#国内国际
贵州通报石家庄市一例新冠肺炎确诊病例在黔活动情况,2021/1/12 21:54,频道稿件编辑统计查询#本网原创#吴锋#贵州频道#采编人员信息统计
法国累计新冠确诊病例超30万例,2020/9/4 17:05,国际要闻
印尼羽球名将苏卡穆约感染新冠病毒 无缘泰国赛,2021/1/5 8:57,体育
美国新冠肺炎疫苗供应不足引多州指责,2021/1/18 16:22,国际#美洲#滚动新闻
韩因“新冠抑郁”自杀者激增 疫情反复 “心魔”难除,2020/12/10 16:55,韩国频道#社会#专题#国际#原创新闻#独家稿库#滚动#抗击新冠肺炎疫情#滚动新闻
世卫组织：全球累计新冠确诊病例达72196732例,2020/12/17 5:14,国际
我国已累计开展新冠病毒疫苗接种九百多万剂次（国务院联防联控机制发布会）,2021/1/10 7:55,国内#滚动新闻#陕西频道#要闻
谭德塞接触新冠确诊者后隔离：感觉良好 无任何症状,2020/11/2 11:27,频道稿件编辑统计查询#国际要闻#贵州频道#采编人员信息统计#吴锋
【#辽宁新增5例本土确诊#】#新冠肺炎最...,2020/12/31 7:57,
12月9日辽宁无新增新冠肺炎确诊病例,2020/12/10 8:09,头条二
防范变异新冠病毒 日本28日起暂停批准外国人入境,2020/12/27 8:28,社会| 法治#滚动新闻#上海频道
修文县举行秋冬季新冠肺炎疫情防控综合演练,2020/11/20 16:04,采编人员信息统计#贵州频道#时政要闻#郜林筱#频道稿件编辑统计查询#地方网群#修文视窗
记者探访抗击新冠肺炎疫情专题展,2020/10/14 21:56,周倩文#社会民生#民生万象#本网原创#湖北#新闻中心#湖北频道#地方要闻
印度新冠肺炎确诊病例超420万,2020/9/8 16:45,贵州频道#采编人员信息统计#国际要闻#陈晶晶#频道稿件编辑统计查询
日本发布研究：新冠病毒变异后传染性更强 从欧洲开始扩散,2020/11/13 16:05,中日万象
【#朴槿惠需接受新冠病毒检测# 所在拘留...,2020/12/22 9:30,
世卫组织：全球累计新冠确诊病例达72851747例,2020/12/18 8:52,健康舆情#人民健康网
我国已累计开展新冠病毒疫苗接种九百多万剂次（国务院联防联控机制发布会）,2021/1/10 10:51,科教文卫#青海频道#滚动新闻
日本新增新冠确诊病例再超千例,2020/8/21 0:32,中日万象
全球新冠病例破4000万 疫情缘何加速上升,2020/10/21 8:54,观察评论#人民健康网
1月27日0-12时 石家庄全市无新增新冠肺炎无症状感染者,2021/1/27 18:28,河北频道#河北坚决打赢疫情防控阻击战#石家庄#疫情防控新闻发布会#滚动新闻#河北疫情防控#坚决打赢疫情防控阻击战 河北在行动#健康#频道原创新闻#防控疫情，各地在行动#地方要闻#河北
一发热就担心是新冠？可能是空调惹的祸,2020/9/2 16:19,达医晓护#身体密码#科普中国#人民网原创#疾病防控#乐享健康#图文原创平台#总图文原创#闫涵#科学养生
研究显示血癌患者在新冠疫情中尤其脆弱,2020/8/26 18:46,滚动新闻#全球抗疫进行时#国际
青海省抗击新冠肺炎疫情表彰大会将于12月1日举行,2020/11/30 9:02,青海要闻#滚动新闻#青海频道
维生素D水平低者容易感染新冠病毒,2020/7/28 16:43,浙江频道#网摘
18日辽宁无新增新冠肺炎确诊病例,2020/11/19 8:42,人民健康网
18日辽宁无新增新冠肺炎确诊病例,2020/11/19 8:08,头条二
约翰斯・霍普金斯大学：美国累计新冠确诊病例超1500万例,2020/12/9 12:30,高清图库#江西频道
世卫组织：全球累计新冠确诊病例达71051805例,2020/12/16 9:05,国际要闻
河北省5日新增20例本地新冠肺炎确诊病例,2021/1/6 15:01,江苏频道#国内・国际
世卫组织：全球累计新冠确诊病例达71581532例,2020/12/16 9:02,国际
世卫组织：全球累计新冠确诊病例达71581532例,2020/12/16 6:28,滚动新闻#全球抗疫进行时#国际
今年底我国新冠疫苗年产能将达6.1亿剂,2020/10/21 9:57,人民创投
世卫组织：全球累计新冠确诊病例达70461926例,2020/12/14 8:43,国际
秋冬季新冠肺炎疫情会不会卷土重来？疾控专家回应了,2020/8/20 16:45,王艳#科普社区#黑龙江频道#时政要闻#科普龙江
【#辽宁新增本土确诊7例#】#新冠肺炎最...,2020/12/27 7:57,
世卫组织：全球累计新冠确诊病例达70461926例,2020/12/14 8:39,人民健康网#健康舆情
台湾新冠肺炎确诊病例增至535人,2020/10/16 20:23,台湾频道#岛内万象#台湾新闻滚动
世卫组织：全球累计新冠确诊病例达72851747例,2020/12/18 7:52,江西频道#国内国际
秘鲁新冠病例超96.7万 2021年春或暴发第二波疫情,2020/12/4 8:42,国际
美国已有超过50万儿童感染新冠病毒,2020/9/11 1:29,国内国际#江西频道
研发团队：新冠灭活疫苗研发生产能够实现快速、有效、足量,2020/9/17 15:58,原创稿件#人民健康网#行业热点
林郑月娥：香港已订购2250万剂新冠疫苗,2020/12/24 8:15,国内国际#江西频道
上海今起可预约接种新冠疫苗 须是因私出国工作、学习人员,2021/1/7 8:39,滚动新闻#上海频道#要闻
国家卫健委：全国新冠疫苗接种平稳有序 接种剂次已超1000万,2021/1/13 17:13,人民健康网#本网原创#国务院联防联控机制介绍近期新冠肺炎疫情防控和医疗救治有关情况#原创稿件
全球累计新冠确诊病例达31664104例,2020/9/25 9:47,健康
世卫组织：全球报告新冠确诊累计超9496万例 死亡超205万例,2021/1/21 9:01,国际#全球抗疫进行时#独家稿库#滚动新闻#张朋辉
中方加入“新冠肺炎疫苗实施计划”促公平分配,2020/10/9 18:47,国内・国际#江苏频道
【#美国新冠确诊超过1000万例#】#全...,2020/11/10 6:59,
全校159人中127人确诊 韩一教会学校暴发新冠集体感染,2021/1/25 16:07,滚动新闻#滚动#抗击新冠肺炎疫情#独家稿库#原创新闻#韩国频道#社会#国际#专题
世卫组织：全球累计新冠确诊病例达71051805例,2020/12/15 11:32,国际要闻
世卫组织：全球累计新冠确诊病例达55928327例,2020/11/20 8:32,要闻#上海频道#美食| 健康#国际#滚动新闻
第八版新冠肺炎诊疗方案发布,2020/8/20 16:50,健康
大连港一冷链企业4名工作人员新冠病毒核酸检测呈阳性,2020/12/16 7:55,北京频道#国内资讯
1月26日甘肃新增4例境外输入新冠肺炎确诊病例,2021/1/27 9:17,最新资讯#本网专稿#最新通报#甘肃
约翰斯・霍普金斯大学：全球累计新冠确诊病例超7000万例,2020/12/12 9:40,健康舆情#人民健康网
俄外长因接触新冠患者隔离 克宫：普京未与其接触,2020/10/28 8:26,国际
以色列：约50%新增确诊病例感染病毒为英国发现的新冠病毒变异株,2021/1/27 14:21,国际#安国章专栏#新闻快递#亚太
约翰斯・霍普金斯大学：美国累计新冠确诊病例超2200万例,2021/1/10 9:07,特别关注
南澳大利亚州实行“居家令”应对新冠聚集性感染,2020/11/19 9:29,滚动新闻#亚太#全球抗疫进行时#国际
全球累计新冠确诊病例达40251950例,2020/10/21 14:39,健康
约翰斯・霍普金斯大学：全球累计新冠确诊病例超7000万例,2020/12/12 9:26,国内・国际#江苏频道
维生素D水平低者容易感染新冠病毒,2020/7/28 16:12,科技
洛杉矶每8分钟就有1人死于新冠 加州批准牙医参与疫苗接种,2021/1/8 10:54,聚焦美国#美国频道#滚动新闻
世卫组织：全球累计新冠确诊病例达72851747例,2020/12/18 8:38,要闻#上海频道#滚动新闻#美食| 健康#国际
老挝宣布新冠患者清零,2020/6/10 16:44,南亚东南亚视窗
伊拉克新冠确诊病例超14万例,2020/8/7 18:16,国际#滚动新闻#中东
为观山湖区这个集体荣获“贵州省抗击新冠肺炎疫情先进集体”称号点赞,2021/1/22 11:19,贵州频道#采编人员信息统计#聚焦观山湖#郜林筱#频道稿件编辑统计查询#地方网群#观山湖视窗
美知名脱口秀主持人感染新冠 《艾伦秀》暂停录制,2020/12/11 9:57,滚动新闻#美国频道#聚焦美国
美副总统或于近日接种新冠疫苗 第二款疫苗有望获批,2020/12/16 11:02,美国频道
延边：关于做好冬春季新冠肺炎疫情防控工作的通告,2021/1/12 11:49,最新消息
印尼累计新冠确诊病例达89869例,2020/7/22 17:14,南亚东南亚视窗
综合消息：中东多国呼吁警惕秋冬季节新冠疫情反复,2020/10/16 16:13,中东#滚动新闻#全球抗疫进行时#国际#深度报道
福建新冠病毒核酸1人1检测项目降价 每人次为80元,2021/1/5 11:36,林东晓#综合#本网原创#统计#采访部#卫生健康#福建频道#新闻列表#吕春荣
隐瞒新冠病情泡温泉　日本一男子被捕,2020/12/4 15:38,中日万象
乌鲁木齐部分新冠病例经反复检测才被发现,2020/8/15 16:51,国内・时政
大连港一冷链企业4名工作人员新冠病毒核酸检测呈阳性,2020/12/16 8:24,国内・国际#江苏频道
大连港一冷链企业4名工作人员新冠病毒核酸检测呈阳性,2020/12/16 8:14,国内新闻#安徽新闻列表
俄媒：近半数俄民众不准备接种新冠疫苗,2020/9/12 6:46,人民网俄罗斯分公司报道集#消息#国际#滚动新闻#独家稿库#俄罗斯频道#社会#滚动
高福：加强疫情分析研判 以“四早”应对流感+新冠挑战,2020/11/2 16:08,人民健康网
首批10万剂国药集团新冠灭活疫苗抵达澳门,2021/2/6 19:23,港澳
敦化市公交和出租汽车行业从业人员完成首轮新冠肺炎病毒核酸检测,2021/1/22 16:57,吉林频道#小德川流 大德敦化
我国已累计开展新冠病毒疫苗接种九百多万剂次（国务院联防联控机制发布会）,2021/1/10 7:53,湖北频道#新闻中心#环球#国内#关喜艳
